name,brand,category1,category2
BUMPKIN Printed Women's Tunic,BUMPKIN,Clothing,Women's Clothing
Oner Casual Short Sleeve Printed Women's Top,Oner,Clothing,Women's Clothing
BONHEUR Casual Sleeveless Solid Women's Top,BONHEUR,Clothing,Women's Clothing
ENTEASE Casual 3/4 Sleeve Printed Women's Top,ENTEASE,Clothing,Women's Clothing
BONHEUR Casual Full Sleeve Floral Print Women's Top,BONHEUR,Clothing,Women's Clothing
IPG Cotton Solid Women's Dupatta,IPG,Clothing,Women's Clothing
Only Women's Double Breasted,Only,Clothing,Women's Clothing
iWonder Solid Women's Regular Skirt,iWonder,Clothing,Women's Clothing
American Swan Solid Women's Regular Skirt,American Swan,Clothing,Women's Clothing
Nordlich Printed Cotton Women's Harem Pants,Nordlich,Clothing,Women's Clothing
Gwyn lingerie Floral Print Women's Gathered Skirt,Gwyn lingerie,Clothing,Women's Clothing
SVT ADA COLLECTIONS Solid Women's Regular Skirt,SVT ADA COLLECTIONS,Clothing,Women's Clothing
Zadine Printed Cotton Women's Harem Pants,Zadine,Clothing,Women's Clothing
Love More Printed Women's Anarkali Kurta,Love More,Clothing,Women's Clothing
Love More Printed Women's Straight Kurta,Love More,Clothing,Women's Clothing
Souminie by Belle Lingeries - Pure Cotton Non Stretchable Black Dailywear Mature Women's Full Coverage Bra,Souminie,Clothing,Women's Clothing
Redesign Printed Women's Jumpsuit,Redesign,Clothing,Women's Clothing
Mee Mee Women's Maternity Panty,Mee Mee,Clothing,Women's Clothing
PerfectBlue Printed Bhagalpuri Cotton Sari,PerfectBlue,Clothing,Women's Clothing
morpankh Enterprise Floral Print Bollywood Georgette Sari,morpankh Enterprise,Clothing,Women's Clothing
Hers by Herman Lingerie Set,Hers by Herman,Clothing,Women's Clothing
UR Image Lingerie Set,UR Image,Clothing,Women's Clothing
"NumBrave Casual 3/4 Sleeve Solid Women's Black, Green, Pink Top",NumBrave,Clothing,Women's Clothing
"NumBrave Casual 3/4 Sleeve Solid Women's Red, Pink Top",NumBrave,Clothing,Women's Clothing
Voylla Artificial Classic Embellished Silver Cubic Zirconia Alloy Pendant,Voylla,Clothing,Women's Clothing
Embibo Women's Nighty with Robe,Embibo,Clothing,Women's Clothing
Voylla Artificial Classic Embellished Yellow Gold Cubic Zirconia Alloy Pendant,Voylla,Clothing,Women's Clothing
Embibo Women's Nighty,Embibo,Clothing,Women's Clothing
"Embibo Women's Nighty with Robe, Top and Capri",Embibo,Clothing,Women's Clothing
DWM Cotton Solid Patiala,DWM,Clothing,Women's Clothing
Lotusa Printed sartan silk Women's Scarf,Lotusa,Clothing,Women's Clothing
Ethna Women's Solid Casual Shirt,Regular,Clothing,Women's Clothing
Famous by Payal Kapoor Women's Printed Casual Shirt,Regular,Clothing,Women's Clothing
Indigocart Printed Women's Regular Skirt,Indigocart,Clothing,Women's Clothing
X-Poz Women's Grey Dungaree,X-Poz,Clothing,Women's Clothing
Perfect Women's Leggings,Perfect,Clothing,Women's Clothing
HIMGIRI Women's Leggings,HIMGIRI,Clothing,Women's Clothing
Glus Perfect Body Women's T-Shirt Bra,Purple,Clothing,Women's Clothing
Vaishna Fashion Women's Full Coverage Bra,Black,Clothing,Women's Clothing
S4S Stylish Women's Push-up Bra,Pink,Clothing,Women's Clothing
Grafion Comfortable Women's Full Coverage Bra,White,Clothing,Women's Clothing
Ploomz Fashion Women's T-Shirt Bra,Black,Clothing,Women's Clothing
Younky Fashion Women's T-Shirt Bra,Brown,Clothing,Women's Clothing
Grafion by Grafion - Comfort Feel Women's Full Coverage Bra,Black,Clothing,Women's Clothing
Hemali C Cup Women's Full Coverage Bra,Green,Clothing,Women's Clothing
Florentyne Padded Push-up Bra Women's Push-up Bra,Blue,Clothing,Women's Clothing
S4S Printed Women's Full Coverage Bra,Black,Clothing,Women's Clothing
Wolfie Shiningbrown111 Women's Full Coverage Bra,Brown,Clothing,Women's Clothing
Q-rious Adore Women's Balconette Bra,Maroon,Clothing,Women's Clothing
Luxemburg Bandaeu Women's Tube Bra,Purple,Clothing,Women's Clothing
Two Dots Comfortable Women's Sports Bra,Purple,Clothing,Women's Clothing
PrettySecrets Fashion Women's Push-up Bra,Blue,Clothing,Women's Clothing
Ploomz Fashion Women's Full Coverage Bra,Black/ White,Clothing,Women's Clothing
Status Multi Color Women's Full Coverage Bra,Purple,Clothing,Women's Clothing
Ploomz Women's Push-up Bra,Royal Blue,Clothing,Women's Clothing
Status Fashionable Women's T-Shirt Bra,Red,Clothing,Women's Clothing
Ploomz Women's T-Shirt Bra,Light Pink,Clothing,Women's Clothing
Madaam NonPadded Women's Tube Bra,Dark Pink,Clothing,Women's Clothing
S4S Comfortable Women's Full Coverage Bra,Blue,Clothing,Women's Clothing
Laceandme Super Comfort Bandeau Women's Tube Bra,Black,Clothing,Women's Clothing
Itsmuahlife by ItsMuahLife - Dazzle Women's Full Coverage Bra,Green,Clothing,Women's Clothing
Younky Fashion Women's Full Coverage Bra,Black,Clothing,Women's Clothing
Floozy Its My Choice Women's Push-up Bra,Light Pink,Clothing,Women's Clothing
Ladyland Mybra Women's Full Coverage Bra,Red,Clothing,Women's Clothing
Tia by Ten on Ten Polka Women's Push-up Bra,Yellow,Clothing,Women's Clothing
Vivity Women's Plunge Bra,Brown,Clothing,Women's Clothing
SAP Net Padded Women's Full Coverage Bra,Yellow,Clothing,Women's Clothing
Scorpio Fashions Women's T-Shirt Bra,Red,Clothing,Women's Clothing
S4S Women's Full Coverage Bra,Purple,Clothing,Women's Clothing
Soul Whisperer Women's Full Coverage Bra,Olive Green,Clothing,Women's Clothing
Status Push-Up Women's T-Shirt Bra,Black,Clothing,Women's Clothing
Grafion Comfort Feel Women's Full Coverage Bra,White,Clothing,Women's Clothing
Our Rituals CDPY35 Women's Tube Bra,Pink,Clothing,Women's Clothing
Secret Wish Cherry Print Navy Underwired Women's Full Coverage Bra,Navy,Clothing,Women's Clothing
Oleva Full Coverage Bra,Blue,Clothing,Women's Clothing
La Verite Pro Women's Tube Bra,Blue,Clothing,Women's Clothing
Urbaano Bridal Bra Pack Women's Full Coverage Bra,Blue,Clothing,Women's Clothing
Hemali Fashion Women's Full Coverage Bra,Grey,Clothing,Women's Clothing
Status Mansi Black Women's Push-up Bra,Black,Clothing,Women's Clothing
Hemali Transparent Women's Push-up Bra,Purple,Clothing,Women's Clothing
Q-rious Infactuate Women's Balconette Bra,Mehroon,Clothing,Women's Clothing
Younky Blue Women's Full Coverage Bra,Blue,Clothing,Women's Clothing
Ladyland Dia Beige Women's Full Coverage Bra,Beige,Clothing,Women's Clothing
Urbaano Women's Full Coverage Bra,Purple,Clothing,Women's Clothing
Grafion by Grafion - Comfort Feel Women's Tube Bra,Black,Clothing,Women's Clothing
Vivity Casual Women's Full Coverage Bra,White,Clothing,Women's Clothing
Glus Fillet Women's Plunge Bra,Grey,Clothing,Women's Clothing
Our Rituals CDMP26 Women's Tube Bra,Majenta,Clothing,Women's Clothing
Tia by Ten on Ten Percy Women's T-Shirt Bra,Black,Clothing,Women's Clothing
Peri Peri Women's Push-up Bra,Multicolor,Clothing,Women's Clothing
Laceandme Naughty Lips Silicone Nipple Covers Women's Stick-on Bra,red,Clothing,Women's Clothing
Vivity Women's Full Coverage Bra,White,Clothing,Women's Clothing
Our Rituals CDPB43 Women's Tube Bra,Purple,Clothing,Women's Clothing
JSR Paris Beauty COTTON NET Women's Full Coverage Bra,RED,Clothing,Women's Clothing
Ploomz Fashion Women's Push-up Bra,Blue,Clothing,Women's Clothing
Vivity Plain Women's Full Coverage Bra,Purple,Clothing,Women's Clothing
"ShowTime Women's Full Coverage, T-Shirt Bra",White,Clothing,Women's Clothing
Tia by Ten on Ten Melange Women's Full Coverage Bra,Light Blue,Clothing,Women's Clothing
JSR Paris Beauty Pro Women's Full Coverage Bra,White,Clothing,Women's Clothing
Ladyland Daisy Pink Women's Full Coverage Bra,Pink,Clothing,Women's Clothing
Pink Pearl Figure Women's Full Coverage Bra,White,Clothing,Women's Clothing
S4S Stylish Women's Full Coverage Bra,Purple,Clothing,Women's Clothing
Grafion Fashion Women's Tube Bra,Pink,Clothing,Women's Clothing
Status B Plus Cup Women's Full Coverage Bra,Brown,Clothing,Women's Clothing
Tia by Ten on Ten Perla Women's T-Shirt Bra,Black,Clothing,Women's Clothing
Ladyland Liz Black Bra Women's Full Coverage Bra,Black,Clothing,Women's Clothing
SAP Printed Padded Women's Full Coverage Bra,Purple,Clothing,Women's Clothing
Vivity Comfortable Women's Plunge Bra,Orange,Clothing,Women's Clothing
Florentyne Women's Full Coverage Bra,White,Clothing,Women's Clothing
Ladyland Stellah Women's Full Coverage Bra,White,Clothing,Women's Clothing
Riya Gold Women's Full Coverage Bra,Black,Clothing,Women's Clothing
Lovinoform Latest Fashionable Stylist Cotton Women's Full Coverage Bra,Maroon,Clothing,Women's Clothing
Status Fashion Women's T-Shirt Bra,Black,Clothing,Women's Clothing
"PrivateLifes MultiStraps Women's T-Shirt, Push-up Bra",Beige,Clothing,Women's Clothing
Tia by Ten on Ten Princa Women's T-Shirt Bra,Beige,Clothing,Women's Clothing
Madaam Organic Cotton Women's Full Coverage Bra,Grey,Clothing,Women's Clothing
VRK Women's Stick-on Bra,Beige,Clothing,Women's Clothing
Ultrafit by Ultrafit - Regular Use Women's Full Coverage Bra,Green,Clothing,Women's Clothing
Muquam Women's Tube Bra,Black,Clothing,Women's Clothing
Oleva Women's Sports Bra,Light Brown,Clothing,Women's Clothing
JSR Paris Beauty Seamless Moulded Women's Full Coverage Bra,Skin,Clothing,Women's Clothing
Ladyland Cozy Women's Full Coverage Bra,Beige,Clothing,Women's Clothing
Madaam Sports Bra Women's Full Coverage Bra,Black,Clothing,Women's Clothing
Lovinoform Latest Comfortable Stylist Non Padded Red Cotton Women's Full Coverage Bra,Red,Clothing,Women's Clothing
Luxemburg Women's Tube Bra,Purple,Clothing,Women's Clothing
Ladyland Life Women's Full Coverage Bra,Blue,Clothing,Women's Clothing
Peri Peri Women's Bra,Beige,Clothing,Women's Clothing
Tia by Ten on Ten Lizzy Women's T-Shirt Bra,White,Clothing,Women's Clothing
Younky Beige Women's Full Coverage Bra,Beige,Clothing,Women's Clothing
Tia by Ten on Ten Fashion Women's Push-up Bra,Blue,Clothing,Women's Clothing
Urbaano Lace Bra Women's Full Coverage Bra,Red,Clothing,Women's Clothing
PrettySecrets Yellow Cotton Comfort Women's T-Shirt Bra,Yellow,Clothing,Women's Clothing
Magiq Nice Merry Women's Push-up Bra,Blue,Clothing,Women's Clothing
Vaishna Pro Women's Full Coverage Bra,Black,Clothing,Women's Clothing
Luxemburg Bandeau Women's Tube Bra,Purple,Clothing,Women's Clothing
Our Rituals CDMR28 Women's Tube Bra,Majenta,Clothing,Women's Clothing
Tia by Ten on Ten Vintage Women's T-Shirt Bra,Red,Clothing,Women's Clothing
Floret Women's Bra,MAGENTA,Clothing,Women's Clothing
Luxemburg Purple color Women's Tube Bra,Purple,Clothing,Women's Clothing
Tia by Ten on Ten Bella Women's T-Shirt Bra,Blue,Clothing,Women's Clothing
Status Neon Elastic Women's Minimizer Bra,Pink,Clothing,Women's Clothing
Glus Accu Point Women's T-Shirt Bra,Beige,Clothing,Women's Clothing
Urbaano Bang Women's Full Coverage Bra,Black,Clothing,Women's Clothing
New Pearl Women's Full Coverage Bra,White,Clothing,Women's Clothing
Our Rituals CDWR59 Women's Tube Bra,White,Clothing,Women's Clothing
Tia by Ten on Ten Penny Women's T-Shirt Bra,Beige,Clothing,Women's Clothing
Tia by Ten on Ten Velvet Women's Push-up Bra,Beige,Clothing,Women's Clothing
Muquam Stretchable Bandeau Women's Tube Bra,White,Clothing,Women's Clothing
Triumph Form & Beauty 47 N Women's Full Coverage Bra,SKIN,Clothing,Women's Clothing
Zeroradius White and Black Strapless Women's Tube Bra,White,Clothing,Women's Clothing
Glus Sweet Angel Women's Push-up Bra,Black,Clothing,Women's Clothing
Vivity KFB-24 Women's Plunge Bra,Blue,Clothing,Women's Clothing
Luxemburg Strapless Bandaeu Women's Tube Bra,Dark Pink,Clothing,Women's Clothing
Lovinoform Latest Comfortable Stylist Non Padded Skin Cotton Women's Full Coverage Bra,Skin,Clothing,Women's Clothing
Ploomz Women's Full Coverage Bra,Black,Clothing,Women's Clothing
PrivateLifes Polka Lace Women's T-Shirt Bra,Pink,Clothing,Women's Clothing
Glus Transy Back Women's T-Shirt Bra,Black,Clothing,Women's Clothing
Lovinoform Latest Comfortable Stylist Non Padded red Cotton Women's Full Coverage Bra,Red,Clothing,Women's Clothing
Lovinoform Latest Comfortable Stylist Padded Cotton Mauve Women's Push-up Bra,Mauve,Clothing,Women's Clothing
Our Rituals CDPW38 Women's Tube Bra,Purple,Clothing,Women's Clothing
Status T-Shirt Bra Women's Full Coverage Bra,White,Clothing,Women's Clothing
Lovinoform Latest Comfortable Stylist Padded Cotton Maroon Women's Push-up Bra,Falsa,Clothing,Women's Clothing
Sherry by Sherry - 512 Women's T-Shirt Bra,White,Clothing,Women's Clothing
Wolfie Women's Full Coverage Bra,Purple,Clothing,Women's Clothing
Tia by Ten on Ten Cathy Women's T-Shirt Bra,White,Clothing,Women's Clothing
Tia by Ten on Ten Siana Women's T-Shirt Bra,Pink,Clothing,Women's Clothing
Status Fashion Women's Full Coverage Bra,Black,Clothing,Women's Clothing
Shoba Women's Tube Bra,Black,Clothing,Women's Clothing
Ploomz Fashion Women's Tube Bra,White,Clothing,Women's Clothing
Soie Classic Women's T-Shirt Bra,Rouge Red,Clothing,Women's Clothing
Tia by Ten on Ten Lacy Women's Push-up Bra,Black,Clothing,Women's Clothing
Glus Front Open Women's Balconette Bra,Beige,Clothing,Women's Clothing
Lusty Lingerie Strapless Bandaeu Women's Tube Bra,White,Clothing,Women's Clothing
Tia by Ten on Ten Fiona Women's T-Shirt Bra,Beige,Clothing,Women's Clothing
Triumph Form & Beauty 30 W Women's Bra,Deep Lavender,Clothing,Women's Clothing
Glus Angellove Women's T-Shirt Bra,White,Clothing,Women's Clothing
Ladyland Life White Women's Full Coverage Bra,White,Clothing,Women's Clothing
Q-rious Accord Women's Full Coverage Bra,White,Clothing,Women's Clothing
Luxemburg Sports Women's Push-up Bra,Black,Clothing,Women's Clothing
PrivateLifes Strapless Women's Push-up Bra,Beige,Clothing,Women's Clothing
Pink Pearl Blush Women's Full Coverage Bra,Red,Clothing,Women's Clothing
Our Rituals CDPB37 Women's Tube Bra,Pink,Clothing,Women's Clothing
Shoba SHTBSKN Women's Tube Bra,Skin,Clothing,Women's Clothing
PrivateLifes Privacy Women's Tube Bra,Multicolor,Clothing,Women's Clothing
Tia by Ten on Ten Persa Women's T-Shirt Bra,Maroon,Clothing,Women's Clothing
Peri Peri Women's Full Coverage Bra,White,Clothing,Women's Clothing
Tia by Ten on Ten Fanny Women's T-Shirt Bra,Pink,Clothing,Women's Clothing
Pink Pearl Swish Women's Full Coverage Bra,Black,Clothing,Women's Clothing
Hemali Pink Women's T-Shirt Bra,Pink,Clothing,Women's Clothing
Oleva ODC04632 Women's Full Coverage Bra,Multicolor,Clothing,Women's Clothing
Status Fashion Women's Minimizer Bra,Purple,Clothing,Women's Clothing
Zet Zone Fashionable Women's Full Coverage Bra,Gold,Clothing,Women's Clothing
"ShowTime Women's Full Coverage, Sports Bra",White,Clothing,Women's Clothing
Peches by Peches - Black Basic With Detachable Straps Women's Push-up Bra,Black,Clothing,Women's Clothing
Penny T-Shirt Bra,Black,Clothing,Women's Clothing
Our Rituals CDPY20 Women's Tube Bra,Carrot Pink,Clothing,Women's Clothing
Lovinoform Latest Comfortable Stylist Non Padded Green Cotton Women's Full Coverage Bra,Green,Clothing,Women's Clothing
Lovinoform Latest Comfortable Stylist Non Padded White Cotton Women's Full Coverage Bra,White,Clothing,Women's Clothing
Tia by Ten on Ten Stripey Women's T-Shirt Bra,Grey,Clothing,Women's Clothing
Lovinoform Latest Comfortable Stylist Non Padded Black Cotton Women's Full Coverage Bra,Black,Clothing,Women's Clothing
Wolfie Pro Women's Push-up Bra,Black,Clothing,Women's Clothing
Glus Frontopen Women's Push-up Bra,Pink,Clothing,Women's Clothing
Ladyland Comfy Beige Women's Full Coverage Bra,Beige,Clothing,Women's Clothing
Lovinoform Latest Comfortable Stylist Non Padded N.Blue Cotton Women's Full Coverage Bra,N.Blue,Clothing,Women's Clothing
Our Rituals CDPP18 Women's Tube Bra,Carrot Pink,Clothing,Women's Clothing
Lovinoform Latest Comfortable Stylist Non Padded Blue Cotton Women's Full Coverage Bra,Blue,Clothing,Women's Clothing
Ladyland Jenifer Women's Full Coverage Bra,Black,Clothing,Women's Clothing
Ladyland Daisy Purple Women's Full Coverage Bra,Purple,Clothing,Women's Clothing
Zet Zone New Fashionable Women's Full Coverage Bra,White,Clothing,Women's Clothing
Laceandme Super Comfort Women's Stick-on Bra,Beige,Clothing,Women's Clothing
"PrettySecrets Women's T-Shirt, Push-up Bra",Red,Clothing,Women's Clothing
Glus PerfectCleavage Women's Balconette Bra,Black,Clothing,Women's Clothing
Status First Love Women's Minimizer Bra,White,Clothing,Women's Clothing
Lovinoform Latest Comfortable Stylist Non Padded Firozy Cotton Women's Full Coverage Bra,Firozy,Clothing,Women's Clothing
Tia by Ten on Ten Floral Women's Push-up Bra,Blue,Clothing,Women's Clothing
Luxemburg Beige color Women's Tube Bra,Beige,Clothing,Women's Clothing
Leading Lady Women's Full Coverage Bra,White,Clothing,Women's Clothing
"Wetex Premium S017BLK,WHT,SKN Women's Full Coverage Bra",Multicolor,Clothing,Women's Clothing
Oleva Women's Full Coverage Bra,Grey,Clothing,Women's Clothing
Peches by Peches Women's Balconette Bra,Grey,Clothing,Women's Clothing
Tia by Ten on Ten Funky Women's T-Shirt Bra,Black,Clothing,Women's Clothing
JSR Paris Beauty Cotton Net Women's Full Coverage Bra,Purple,Clothing,Women's Clothing
Floret Comfortable Women's T-Shirt Bra,Yellow,Clothing,Women's Clothing
Luxemburg Red Black and Pink Color Women's Tube Bra,Red,Clothing,Women's Clothing
Wolfie Shiningblack112 Women's Full Coverage Bra,Black,Clothing,Women's Clothing
Tia by Ten on Ten Fashion Women's Full Coverage Bra,Brown,Clothing,Women's Clothing
Tia by Ten on Ten Comforting Women's Full Coverage Bra,Red,Clothing,Women's Clothing
Glus PerfectBody Women's T-Shirt Bra,Blue,Clothing,Women's Clothing
Ladyland Cozy White Women's Full Coverage Bra,White,Clothing,Women's Clothing
Shoba Tb Non Women's Tube Bra,Black,Clothing,Women's Clothing
Lovinoform Latest Comfortable Stylist Non Padded Mauve Cotton Women's Full Coverage Bra,Mauve,Clothing,Women's Clothing
PrivateLifes Leopard Bra Women's Push-up Bra,Leopard Print,Clothing,Women's Clothing
Lovinoform Latest Comfortable Stylist Non Padded Purple Cotton Women's Full Coverage Bra,Purple,Clothing,Women's Clothing
Vivity Women's Maternity Bra,White,Clothing,Women's Clothing
Ploomz Pz-30b Women's T-Shirt Bra,Multicolor,Clothing,Women's Clothing
SK Dreams Fashion Women's Full Coverage Bra,Multicolor,Clothing,Women's Clothing
Younky Women's Sports Bra,Red,Clothing,Women's Clothing
Glus Hug Me Women's Push-up Bra,Green,Clothing,Women's Clothing
SAP Printed Padded Bra Women's Full Coverage Bra,Black,Clothing,Women's Clothing
Peches by Peches - Polyamide Black Polka Dots Demicup Semi Padded Underwired Women's Balconette Bra,Black,Clothing,Women's Clothing
Vivity Plain Women's Plunge Bra,Grey,Clothing,Women's Clothing
Q-rious Dzire Women's Full Coverage Bra,Beige,Clothing,Women's Clothing
Lovinoform Latest Comfortable Stylist Non Padded Mehroon Cotton Women's Full Coverage Bra,Mehroon,Clothing,Women's Clothing
Pink Pearl PD-1510 Women's Full Coverage Bra,Multicolor,Clothing,Women's Clothing
Peches by Peches - Polyamide Padded White Printed Demicup with Removable Pushup Women's Balconette Bra,Grey & White,Clothing,Women's Clothing
Status Fashion Women's Push-up Bra,Purple,Clothing,Women's Clothing
Wolfie LaceRed117 Women's Push-up Bra,Red,Clothing,Women's Clothing
Tia by Ten on Ten Bonnie Women's T-Shirt Bra,Brown,Clothing,Women's Clothing
Page3 P3TBS01 Women's Tube Bra,Skin,Clothing,Women's Clothing
Secretlayer Black Softy Women's Full Coverage Bra,Black,Clothing,Women's Clothing
PrivateLifes Privacy 4pcs Combo Women's Tube Bra,Multicolor,Clothing,Women's Clothing
Wolfie Neonbrapeach101 Women's Push-up Bra,Pink,Clothing,Women's Clothing
Younky Non_Padded Women's Full Coverage Bra,Multicolor,Clothing,Women's Clothing
Tia by Ten on Ten Velvetina Women's Push-up Bra,Dark Pink,Clothing,Women's Clothing
SAP Grey Women's T-Shirt Bra,Grey,Clothing,Women's Clothing
Ladyland Liz Women's Full Coverage Bra,Black,Clothing,Women's Clothing
Hemali Maroon Women's T-Shirt Bra,Maroon,Clothing,Women's Clothing
Sherry Velentine Women's Full Coverage Bra,lavender-Black,Clothing,Women's Clothing
Wolfie Fashion Women's Full Coverage Bra,Maroon,Clothing,Women's Clothing
Lovinoform Latest Comfortable Stylist Non Padded Rani Cotton Women's Full Coverage Bra,Rani,Clothing,Women's Clothing
Magiq Zuhi Women's Full Coverage Bra,Black,Clothing,Women's Clothing
Status Women's Minimizer Bra,Multicolor,Clothing,Women's Clothing
Ladyland BOBBY Women's Full Coverage Bra,Beige,Clothing,Women's Clothing
Riya Gold Girl's Full Coverage Bra,Beige,Clothing,Women's Clothing
Madaam Halter Women's Push-up Bra,Purple,Clothing,Women's Clothing
Tia by Ten on Ten Leone Women's T-Shirt Bra,Beige,Clothing,Women's Clothing
Glus FilletLove Women's T-Shirt Bra,Purple,Clothing,Women's Clothing
Sonari D-14 Women's Full Coverage Bra,Cherry,Clothing,Women's Clothing
Hemali Green Women's T-Shirt Bra,Green,Clothing,Women's Clothing
Lovelady BRALL001001 Women's Minimizer Bra,White,Clothing,Women's Clothing
Nutex by Insaler Women's Full Coverage Bra,Pink,Clothing,Women's Clothing
Tia by Ten on Ten Suzy Women's T-Shirt Bra,Grey,Clothing,Women's Clothing
Glus Yadiali Women's Push-up Bra,Purple,Clothing,Women's Clothing
Status Mansi Cream Black Women's Push-up Bra,Black,Clothing,Women's Clothing
ShowTime Women's T-Shirt Bra,Black,Clothing,Women's Clothing
Lovinoform Latest Comfortable Stylist Non Padded Rust Cotton Women's Full Coverage Bra,Rust,Clothing,Women's Clothing
Page3 P3TBB01 Women's Tube Bra,Black,Clothing,Women's Clothing
Sober Touch Pro Women's Full Coverage Bra,Pink,Clothing,Women's Clothing
Roopsi Vastram Harshi-C Women's Balconette Bra,White,Clothing,Women's Clothing
PrettySecrets White Second Skin Women's Full Coverage Bra,White,Clothing,Women's Clothing
Itsmuahlife by ItsMuahLife - Ever White Women's Full Coverage Bra,White,Clothing,Women's Clothing
Glus LiftUP Women's Push-up Bra,Yellow,Clothing,Women's Clothing
Ladyland Dia Women's Full Coverage Bra,Beige,Clothing,Women's Clothing
Wolfie Polkadotturqoise105 Women's Push-up Bra,Turquise,Clothing,Women's Clothing
Wolfie RibbonMaroon118 Women's Push-up Bra,Maroon,Clothing,Women's Clothing
Magiq Ado tube Women's Tube Bra,White,Clothing,Women's Clothing
Glus Sweet Love Women's T-Shirt Bra,Purple,Clothing,Women's Clothing
Lovinoform Latest Comfortable Stylist Non Padded Pink Cotton Women's Full Coverage Bra,Pink,Clothing,Women's Clothing
Wolfie LeoBeige107 Women's Push-up Bra,Beige,Clothing,Women's Clothing
Glus LiftU Women's Push-up Bra,Magentta,Clothing,Women's Clothing
Tia by Ten on Ten Eliana Women's Full Coverage Bra,Beige,Clothing,Women's Clothing
Grafion Fashion Women's Full Coverage Bra,Black,Clothing,Women's Clothing
Secret Wish Shiny Pink Comfy Women's Full Coverage Bra,Pink,Clothing,Women's Clothing
Wolfie Neonbrablue103 Women's Push-up Bra,Blue,Clothing,Women's Clothing
Page3 P3TBW Women's Tube Bra,White,Clothing,Women's Clothing
Wolfie Designred110 Women's Push-up Bra,Red,Clothing,Women's Clothing
Wolfie Neonbrapink102 Women's Push-up Bra,Pink,Clothing,Women's Clothing
Tia by Ten on Ten Styla Women's Push-up Bra,Beige,Clothing,Women's Clothing
SAP Brown Women's T-Shirt Bra,Brown,Clothing,Women's Clothing
Our Rituals CDSY56 Women's Tube Bra,Skin,Clothing,Women's Clothing
Tia by Ten on Ten Styla Women's Full Coverage Bra,Brown,Clothing,Women's Clothing
Zeroradius Black and Skin Strapless Women's Tube Bra,Black,Clothing,Women's Clothing
La Verite Women's Stick-on Bra,Beige,Clothing,Women's Clothing
Q-rious Ecstasy Women's Full Coverage Bra,Brown,Clothing,Women's Clothing
Tia by Ten on Ten Juliet Women's T-Shirt Bra,White,Clothing,Women's Clothing
PrettySecrets Black Second Skin Women's Full Coverage Bra,Black,Clothing,Women's Clothing
Tia by Ten on Ten Cynara Women's T-Shirt Bra,Red,Clothing,Women's Clothing
Glus Pompon Women's Push-up Bra,Purple,Clothing,Women's Clothing
Zet Zone New Women's Full Coverage Bra,Purple,Clothing,Women's Clothing
PrettySecrets Women's T-Shirt Bra,Grey,Clothing,Women's Clothing
Tia by Ten on Ten Vicky Women's T-Shirt Bra,Green,Clothing,Women's Clothing
Tia by Ten on Ten Jenny Women's T-Shirt Bra,Peach,Clothing,Women's Clothing
Kum-Kum Mold Women's T-Shirt Bra,Light Blue,Clothing,Women's Clothing
Penny Pro Women's T-Shirt Bra,Peach Red,Clothing,Women's Clothing
Love More Printed Women's Flared Kurta,Love More,Clothing,Women's Clothing
Bottoms More Regular Fit Women's Blue Trousers,Bottoms More,Clothing,Women's Clothing
diva boutique Regular Fit Women's Red Trousers,diva boutique,Clothing,Women's Clothing
diva boutique Regular Fit Women's Yellow Trousers,diva boutique,Clothing,Women's Clothing
Goodwill Impex Regular Fit Women's Blue Trousers,Goodwill Impex,Clothing,Women's Clothing
NumBrave Casual Embroidered Women's Kurti,NumBrave,Clothing,Women's Clothing
Fpc Creations Party Printed Women's Kurti,Fpc Creations,Clothing,Women's Clothing
Nordlich Printed Women's Night Shorts,Nordlich,Clothing,Women's Clothing
trustedsnap Solid Women's Tunic,trustedsnap,Clothing,Women's Clothing
Trendy Divva Self Design Women's Basic Shorts,Trendy Divva,Clothing,Women's Clothing
Vero Moda Solid Women's Basic Shorts,Vero Moda,Clothing,Women's Clothing
Lavennder Floral Print Women's Basic Shorts,Lavennder,Clothing,Women's Clothing
Lavennder Printed Women's Basic Shorts,Lavennder,Clothing,Women's Clothing
Vala'S Printed Women's Tunic,Vala'S,Clothing,Women's Clothing
"O Baby Women's Printed White, Dark Green Top & Shorts Set",O Baby,Clothing,Women's Clothing
Vero Moda Self Design Women's Waistcoat,Vero Moda,Clothing,Women's Clothing
VRTYA Casual Short Sleeve Solid Women's Grey Top,VRTYA,Clothing,Women's Clothing
Fabpoppy Casual Sleeveless Solid Women's Blue Top,Fabpoppy,Clothing,Women's Clothing
Fabpoppy Casual Sleeveless Printed Women's Multicolor Top,Fabpoppy,Clothing,Women's Clothing
VRTYA Casual Sleeveless Solid Women's Blue Top,VRTYA,Clothing,Women's Clothing
Roadster Skinny Fit Women's Blue Jeans,Roadster,Clothing,Women's Clothing
HRX by Hrithik Roshan Skinny Fit Women's Blue Jeans,HRX by Hrithik Roshan,Clothing,Women's Clothing
