name,brand,category1,category2
Feminine Casual Sleeveless Printed Women's Multicolor Top,Feminine,Clothing,Women's Clothing
SIESTA Slim Fit Women's Light Blue Jeans,SIESTA,Clothing,Women's Clothing
VRTYA Casual Sleeveless Solid Women's Black Top,VRTYA,Clothing,Women's Clothing
"THELABELLIFE.com Casual Full Sleeve Solid Women's Grey, Black Top",THELABELLIFE.com,Clothing,Women's Clothing
"Coash Casual Sleeveless Printed Women's Black, Pink Top",Coash,Clothing,Women's Clothing
fourgee Slim Fit Women's Blue Jeans,fourgee,Clothing,Women's Clothing
Spa Culture Fit Fit Women's Light Blue Jeans,Spa Culture,Clothing,Women's Clothing
THELABELLIFE.com Casual Full Sleeve Solid Women's White Top,THELABELLIFE.com,Clothing,Women's Clothing
Trend Notes Casual Sleeveless Solid Women's Pink Top,Trend Notes,Clothing,Women's Clothing
EVER WEAR REGULAR Fit Women's Black Jeans,EVER WEAR,Clothing,Women's Clothing
TIMBERLAKE Slim Fit Fit Women's Red Jeans,TIMBERLAKE,Clothing,Women's Clothing
Martini Casual 3/4 Sleeve Solid Women's Maroon Top,Martini,Clothing,Women's Clothing
SVT ADA COLLECTIONS Casual Sleeveless Solid Women's Black Top,SVT ADA COLLECTIONS,Clothing,Women's Clothing
PI ZON Slim Fit Women's Blue Jeans,PI ZON,Clothing,Women's Clothing
Fabpoppy Casual Puff Sleeve Printed Women's Purple Top,Fabpoppy,Clothing,Women's Clothing
"Panit Casual 3/4 Sleeve Floral Print Women's White, Multicolor Top",Panit,Clothing,Women's Clothing
VRTYA Casual Sleeveless Solid Women's Red Top,VRTYA,Clothing,Women's Clothing
Marks & Spencer Solid Turtle Neck Casual Women's Sweater,Marks & Spencer,Clothing,Women's Clothing
Reevolution Casual Short Sleeve Striped Women's Orange Top,Reevolution,Clothing,Women's Clothing
PURYS Casual Roll-up Sleeve Printed Women's White Top,PURYS,Clothing,Women's Clothing
TIMBERLAKE Slim Fit Fit Women's Blue Jeans,TIMBERLAKE,Clothing,Women's Clothing
BrandTrendz Cotton Solid Patiala,BrandTrendz,Clothing,Women's Clothing
Ridhi-Impex Full Sleeve Solid Women's Jacket,Ridhi-Impex,Clothing,Women's Clothing
"Salwar Studio Geometric Print, Paisley Kurta & Salwar",Salwar Studio,Clothing,Women's Clothing
Only Printed Women's Purple Basic Shorts,Only,Clothing,Women's Clothing
Salwar Studio Self Design Kurta & Salwar,Salwar Studio,Clothing,Women's Clothing
F-Loop Self Design Kurta & Churidar,F-Loop,Clothing,Women's Clothing
ZAIRE Casual 3/4 Sleeve Polka Print Women's Top,ZAIRE,Clothing,Women's Clothing
ANASAZI Casual Sleeveless Solid Women's Top,ANASAZI,Clothing,Women's Clothing
Satovira Party Sleeveless Solid Women's Top,Satovira,Clothing,Women's Clothing
Wajbee Casual 3/4 Sleeve Solid Women's Top,Wajbee,Clothing,Women's Clothing
ANASAZI Casual Full Sleeve Striped Women's Top,ANASAZI,Clothing,Women's Clothing
Satovira Party Short Sleeve Solid Women's Top,Satovira,Clothing,Women's Clothing
ANASAZI Casual Full Sleeve Printed Women's Top,ANASAZI,Clothing,Women's Clothing
ZAIRE Casual 3/4 Sleeve Printed Women's Top,ZAIRE,Clothing,Women's Clothing
FATEN Party Sleeveless Embellished Women's Top,FATEN,Clothing,Women's Clothing
Peppermint Blues Casual Short Sleeve Floral Print Women's Top,Peppermint Blues,Clothing,Women's Clothing
Satovira Party Short Sleeve Applique Women's Top,Satovira,Clothing,Women's Clothing
FATEN Casual Sleeveless Printed Women's Top,FATEN,Clothing,Women's Clothing
ANASAZI Casual Sleeveless Striped Women's Top,ANASAZI,Clothing,Women's Clothing
Tryfa Casual Sleeveless Solid Women's Top,Tryfa,Clothing,Women's Clothing
ZAIRE Casual 3/4 Sleeve Floral Print Women's Top,ZAIRE,Clothing,Women's Clothing
Valentine Sportswear Women's Capri,Valentine,Clothing,Women's Clothing
"REAL Graphic Print Girl's, Women's Raincoat",REAL,Clothing,Women's Clothing
Rainfun Self Design Women's Raincoat,Rainfun,Clothing,Women's Clothing
Fame16 Women's Pyjama,Fame16,Clothing,Women's Clothing
"Maniac Solid Women's Round Neck, V-neck Yellow, Pink T-Shirt",Maniac,Clothing,Women's Clothing
Prrem's Full Sleeve Solid Women's Sweatshirt,Prrem's,Clothing,Women's Clothing
Mustard Solid Women's Scoop Neck White T-Shirt,Mustard,Clothing,Women's Clothing
Romano Full Sleeve Solid Women's Sweatshirt,Romano,Clothing,Women's Clothing
Welwear Solid Basic Cap,Welwear,Clothing,Women's Clothing
Welwear Checkered Basic Cap,Welwear,Clothing,Women's Clothing
"Saar Casual, Party Embellished, Printed Women's Kurti",Saar,Clothing,Women's Clothing
Hustler Women's Boy Short Panty,Hustler,Clothing,Women's Clothing
Laadli Boutique Cotton Floral Print Multi-purpose Fabric,Laadli Boutique,Clothing,Women's Clothing
Laadli Bouitique Cotton Floral Print Multi-purpose Fabric,Laadli Bouitique,Clothing,Women's Clothing
Very Me Full Sleeve Solid Women's Jacket,Very Me,Clothing,Women's Clothing
Uptownie Lite Solid Women's Jumpsuit,Uptownie Lite,Clothing,Women's Clothing
Limerence Solid Women's Jumpsuit,Limerence,Clothing,Women's Clothing
Selfcare Women's Camisole,Selfcare,Clothing,Women's Clothing
Fashion18 Solid Babydoll,Fashion18,Clothing,Women's Clothing
Awesome Self Design FAUX GEORGETTE Women's Kaftan,Awesome,Clothing,Women's Clothing
Clovia Women's Camisole,Clovia,Clothing,Women's Clothing
"Zrestha Women's Brown, Pink, Orange Leggings",Zrestha,Clothing,Women's Clothing
G Fashion Printed Cotton Women's Harem Pants,G Fashion,Clothing,Women's Clothing
Ankita Printed Polyester Women's Harem Pants,Ankita,Clothing,Women's Clothing
G Fashion Striped Cotton Women's Harem Pants,G Fashion,Clothing,Women's Clothing
Ankita Printed Cotton Women's Harem Pants,Ankita,Clothing,Women's Clothing
saubhagyawatifashions Festive Printed Women's Kurti,saubhagyawatifashions,Clothing,Women's Clothing
HealthMax Women's Shapewear,HealthMax,Clothing,Women's Clothing
Miway Women's Shift Pink Dress,Miway,Clothing,Women's Clothing
"Fabiya Women's Sheath Blue, Red Dress",Fabiya,Clothing,Women's Clothing
Aurelia Cotton Women's Churidar,Aurelia,Clothing,Women's Clothing
Cobb Women's Dark Blue Capri,Cobb,Clothing,Women's Clothing
Fabpoppy Women's Multicolor Capri,Fabpoppy,Clothing,Women's Clothing
Point Fit Solid Women's V-neck T-Shirt,Point Fit,Clothing,Women's Clothing
"Ethnic Rajasthan Animal Print Women's, Girl's Wrap Around Skirt",Ethnic Rajasthan,Clothing,Women's Clothing
Vero Moda Regular Fit Women's Trousers,Vero Moda,Clothing,Women's Clothing
A A STORE Regular Fit Women's Trousers,A A STORE,Clothing,Women's Clothing
PANIT Regular Fit Women's Trousers,PANIT,Clothing,Women's Clothing
Ankita Printed Rayon Women's Harem Pants,Ankita,Clothing,Women's Clothing
Amirich Printed Women's Multicolor Basic Shorts,Amirich,Clothing,Women's Clothing
Pioneer International Regular Fit Women's Trousers,Pioneer International,Clothing,Women's Clothing
Feminin Women's Hipster Panty,Feminin,Clothing,Women's Clothing
Wajbee Women's Leggings,Wajbee,Clothing,Women's Clothing
"KHI Women's, Girl's Bikini, Brief, Hipster Panty",KHI,Clothing,Women's Clothing
TeeSort Solid Women's Grey Track Pants,TeeSort,Clothing,Women's Clothing
Valentine Women's Nighty,Valentine,Clothing,Women's Clothing
"LAADLI JI Women's Button Solid, Self Design Cardigan",LAADLI JI,Clothing,Women's Clothing
Nineteen Solid Round Neck Casual Women's Sweater,Nineteen,Clothing,Women's Clothing
IndiWeaves Printed Women's Round Neck Multicolor T-Shirt,IndiWeaves,Clothing,Women's Clothing
Fabiya Women's Hipster Panty,Fabiya,Clothing,Women's Clothing
Monmione Women's Push-up Bra,Monmione,Clothing,Women's Clothing
Cinderella Women's Nighty,Cinderella,Clothing,Women's Clothing
RIPR Women's Pyjama,RIPR,Clothing,Women's Clothing
People Full Sleeve Solid Women's Jacket,People,Clothing,Women's Clothing
run of luck Solid Women's Polo Neck Pink T-Shirt,run of luck,Clothing,Women's Clothing
Ajaero Slim Fit Women's Blue Jeans,Ajaero,Clothing,Women's Clothing
Starsy Printed Women's Round Neck Green T-Shirt,Starsy,Clothing,Women's Clothing
Clovia Women's Full Coverage Bra,Clovia,Clothing,Women's Clothing
Viral Girl Women's Full Coverage Bra,Viral Girl,Clothing,Women's Clothing
TSG Breeze Printed Women's Round Neck Multicolor T-Shirt,TSG Breeze,Clothing,Women's Clothing
piftif Women's Sports Bra,piftif,Clothing,Women's Clothing
SLS Slim Fit Women's Blue Jeans,SLS,Clothing,Women's Clothing
fourgee Slim Fit Women's Black Jeans,fourgee,Clothing,Women's Clothing
Clovia Women's T-Shirt Bra,Clovia,Clothing,Women's Clothing
Clovia Women's Sports Bra,Clovia,Clothing,Women's Clothing
Hitobito Full Sleeve Solid Women's Jacket,Hitobito,Clothing,Women's Clothing
SIESTA Slim Fit Women's Black Jeans,SIESTA,Clothing,Women's Clothing
Ajaero Slim Fit Women's Light Blue Jeans,Ajaero,Clothing,Women's Clothing
Clovia Women's Tube Bra,Clovia,Clothing,Women's Clothing
People 3/4 Sleeve Solid Women's Jacket,People,Clothing,Women's Clothing
Starsy Printed Women's Round Neck White T-Shirt,Starsy,Clothing,Women's Clothing
DOLZ Skinny Fit Fit Women's Brown Jeans,DOLZ,Clothing,Women's Clothing
MIRICHI Printed Women's Polo Neck Red T-Shirt,MIRICHI,Clothing,Women's Clothing
Feneto Women's Solid Casual Shirt,Regular,Clothing,Women's Clothing
Qbee Women's Solid Casual Shirt,Slim,Clothing,Women's Clothing
TwiQ S.A. Garments Girl's Tube Black Dress,TwiQ S.A. Garments,Clothing,Women's Clothing
"Athena Women's Maxi Pink, Multicolor Dress",Athena,Clothing,Women's Clothing
Embellish outfits Embroidered Women's Straight Kurta,Embellish outfits,Clothing,Women's Clothing
ADDICTION Floral Print Women's Straight Kurta,ADDICTION,Clothing,Women's Clothing
Embellish outfits Graphic Print Women's Straight Kurta,Embellish outfits,Clothing,Women's Clothing
Clovia Non Padded Women's Full Coverage Bra,YELLOW,Clothing,Women's Clothing
Clovia Women's Plunge Bra,Pink,Clothing,Women's Clothing
Channel Nine Pack of 2 Women's Tube Bra,Nude,Clothing,Women's Clothing
Bralux Dolly Women's T-Shirt Bra,Pink,Clothing,Women's Clothing
Bodyline Bossy Women's T-Shirt Bra,Red,Clothing,Women's Clothing
Da Intimo Seamless Women's T-Shirt Bra,Black,Clothing,Women's Clothing
Clovia Non Padded Women's Plunge Bra,Black,Clothing,Women's Clothing
"Deep Under Maximum Women's Full Coverage, T-Shirt Bra",Grey,Clothing,Women's Clothing
Clovia Cotton Non Padded Non Wired In Nude Women's Full Coverage Bra,SKIN,Clothing,Women's Clothing
Bracotair Pro Women's Full Coverage Bra,Skin,Clothing,Women's Clothing
Bralux Trishna Women's Full Coverage Bra,Black,Clothing,Women's Clothing
Docare Women's Sports Bra,White,Clothing,Women's Clothing
Clovia Non Wired Bra In Ash Gray Women's Full Coverage Bra,GREY,Clothing,Women's Clothing
Bralux Liza Women's Full Coverage Bra,Red,Clothing,Women's Clothing
Care N Care Labela Women's T-Shirt Bra,Skin,Clothing,Women's Clothing
Clovia Side Lace Cotton In Navy Women's Full Coverage Bra,Navy,Clothing,Women's Clothing
Desiharem Pro Women's Full Coverage Bra,Black,Clothing,Women's Clothing
Clovia Cotton Rich Non Padded Wirefree Women's Full Coverage Bra,SKIN,Clothing,Women's Clothing
Clovia Sheer Stretchable Women's Tube Bra,Navy,Clothing,Women's Clothing
Docare Trendy Women's Full Coverage Bra,White and Blue,Clothing,Women's Clothing
Bralux Push Up Women's Push-up Bra,Rani,Clothing,Women's Clothing
Clovia Non Wired Bra In Red Women's Full Coverage Bra,Red,Clothing,Women's Clothing
Chilee Life Contemporary Women's Push-up Bra,Blue,Clothing,Women's Clothing
Care N Care Labela C Women's T-Shirt Bra,Purple,Clothing,Women's Clothing
Bodyline Hosiery High-Touch Designed . Women's T-Shirt Bra,White,Clothing,Women's Clothing
Clovia Padded Women's Plunge Bra,NILE BLUE,Clothing,Women's Clothing
Bralux Madhu Skin Women's Full Coverage Bra,Skin,Clothing,Women's Clothing
"Calibra Women's Full Coverage, T-Shirt Bra",Maroon,Clothing,Women's Clothing
Centra Pro Women's Full Coverage Bra,White,Clothing,Women's Clothing
Clovia In Aqua Women's Full Coverage Bra,Aqua,Clothing,Women's Clothing
Clovia In Black Women's Full Coverage Bra,Black,Clothing,Women's Clothing
"Chilee Life Premium Women's Full Coverage, Push-up Bra",Dark Skinny,Clothing,Women's Clothing
Bralux Rose Women's Full Coverage Bra,White,Clothing,Women's Clothing
Calibra Regular Cup Bra Women's T-Shirt Bra,Multi,Clothing,Women's Clothing
DesiHarem Women's Full Coverage Bra,Black,Clothing,Women's Clothing
Clovia Stretchable Cotton In Green Women's Full Coverage Bra,Green,Clothing,Women's Clothing
Clovia Cotton Rich T Shirt With Cross-Over Moulded Cups Women's Full Coverage Bra,RED,Clothing,Women's Clothing
Bralux 103 Printed Women's Full Coverage Bra,Multicolor,Clothing,Women's Clothing
Bralux Camy Pink Women's Full Coverage Bra,Pink,Clothing,Women's Clothing
DesiHarem Women's Plunge Bra,Black,Clothing,Women's Clothing
Clovia Non Wired Bra In Deep Maroon Women's Full Coverage Bra,Deep Maroon,Clothing,Women's Clothing
"Deep Under Little Heart Women's Full Coverage, T-Shirt Bra",White,Clothing,Women's Clothing
Deep Under Women's Tube Bra,Beige,Clothing,Women's Clothing
Clovia Light padding Women's Plunge Bra,Purple,Clothing,Women's Clothing
Clovia Non Padded Wired Red Women's Full Coverage Bra,RED,Clothing,Women's Clothing
Channel Nine by Channel Nine - Seamless Women's Tube Bra,Turquoise,Clothing,Women's Clothing
TAB91 Praveen Women's Printed Top & Pyjama Set,TAB91,Clothing,Women's Clothing
Zombom Cotton Embroidered Semi-stitched Salwar Suit Dupatta Material,Zombom,Clothing,Women's Clothing
Heart 2 Heart Printed Babydoll,Heart 2 Heart,Clothing,Women's Clothing
SAE FASHIONS Cotton Embroidered Lace,SAE FASHIONS,Clothing,Women's Clothing
"Indianbeauty Self Design, Printed Fashion Georgette Sari",Indianbeauty,Clothing,Women's Clothing
Mahek Saree Striped Fashion Cotton Sari,Mahek Saree,Clothing,Women's Clothing
Vipul Saree Printed Bhagalpuri Raw Silk Sari,Vipul Saree,Clothing,Women's Clothing
BOMBAY VELVAT FAB Embriodered Fashion Georgette Sari,BOMBAY VELVAT FAB,Clothing,Women's Clothing
Kazo Round Neck Woven Women's Pullover,Kazo,Clothing,Women's Clothing
Monte Carlo Solid Round Neck Casual Women's Sweater,Monte Carlo,Clothing,Women's Clothing
Vedant Lifestyle Self Design Fashion Georgette Sari,Vedant Lifestyle,Clothing,Women's Clothing
Spink Solid Round Neck Casual Women's Sweater,Spink,Clothing,Women's Clothing
LATHERO Full Sleeve Self Design Women's Jacket,LATHERO,Clothing,Women's Clothing
V3iShop Animal Print Women's Three Fourths,V3iShop,Clothing,Women's Clothing
Rama Women's Leggings,Rama,Clothing,Women's Clothing
Ashdan Solid Women's Basic Shorts,Ashdan,Clothing,Women's Clothing
Sona FEEDINGBRA Women's Maternity Bra,Sona,Clothing,Women's Clothing
Kanvin Women's Solid Pink Top & Capri Set,Kanvin,Clothing,Women's Clothing
Fab Nisa Self Design Women's Straight Kurta,Fab Nisa,Clothing,Women's Clothing
Fab Nisa Solid Women's Straight Kurta,Fab Nisa,Clothing,Women's Clothing
KANCHOO V-Neck Women's Blouse,KANCHOO,Clothing,Women's Clothing
HUNYBUNI V-Neck Women's Blouse,HUNYBUNI,Clothing,Women's Clothing
ABIDA V-Neck Women's Blouse,ABIDA,Clothing,Women's Clothing
HUNYBUNI Round Neck Women's Blouse,HUNYBUNI,Clothing,Women's Clothing
C9 Solid Women's Round Neck Pink T-Shirt,C9,Clothing,Women's Clothing
"Go India Store Solid Women's Polo Neck Red, Black T-Shirt",Go India Store,Clothing,Women's Clothing
PURYS Printed Women's Round Neck Pink T-Shirt,PURYS,Clothing,Women's Clothing
Yepme Graphic Print Women's V-neck Purple T-Shirt,Yepme,Clothing,Women's Clothing
Yepme Graphic Print Women's V-neck Orange T-Shirt,Yepme,Clothing,Women's Clothing
CLUB YORK Printed Women's Round Neck Purple T-Shirt,CLUB YORK,Clothing,Women's Clothing
Yepme Graphic Print Women's V-neck Red T-Shirt,Yepme,Clothing,Women's Clothing
C9 Printed Women's Round Neck Blue T-Shirt,C9,Clothing,Women's Clothing
Yepme Graphic Print Women's Scoop Neck Pink T-Shirt,Yepme,Clothing,Women's Clothing
C9 Checkered Women's V-neck Blue T-Shirt,C9,Clothing,Women's Clothing
Yepme Graphic Print Women's V-neck Blue T-Shirt,Yepme,Clothing,Women's Clothing
"Go India Store Solid Women's Polo Neck Black, Dark Blue T-Shirt",Go India Store,Clothing,Women's Clothing
FIFO Bottom Women's  Combo,FIFO,Clothing,Women's Clothing
"Shonaya Self Design, Printed Fashion Synthetic Georgette Sari",Shonaya,Clothing,Women's Clothing
Decot Paradise Printed Kurti & Patiyala,Decot Paradise,Clothing,Women's Clothing
Aavaya Fashion Embroidered Kurti & Patiyala,Aavaya Fashion,Clothing,Women's Clothing
SATYA SITA Embriodered Bollywood Georgette Sari,SATYA SITA,Clothing,Women's Clothing
RadadiyaTRD Embriodered Bollywood Georgette Sari,RadadiyaTRD,Clothing,Women's Clothing
ROSHNI FASHIONS Self Design Bollywood Net Sari,ROSHNI FASHIONS,Clothing,Women's Clothing
RadadiyaTRD Embriodered Bollywood Lycra Sari,RadadiyaTRD,Clothing,Women's Clothing
Kook N Keech Disney Solid Women's Jumpsuit,Kook N Keech Disney,Clothing,Women's Clothing
Fab Palace Party Sleeveless Embroidered Women's Top,Fab Palace,Clothing,Women's Clothing
Krasiv Solid Babydoll,Krasiv,Clothing,Women's Clothing
Sai Senorita Solid Women's Half length Tights,Sai Senorita,Clothing,Women's Clothing
Creez Solid Women's Charcoal Full Length Sports Tights,Creez,Clothing,Women's Clothing
Finesse NUTL4474G Dupian Saree Falls,Finesse,Clothing,Women's Clothing
Finesse NUTL4474P Dupian Saree Falls,Finesse,Clothing,Women's Clothing
RIPR Self Design Women's Multicolor Basic Shorts,RIPR,Clothing,Women's Clothing
Kalt Self Design Round Neck Casual Women's Sweater,Kalt,Clothing,Women's Clothing
Kiosha Women's Printed Casual Shirt,Kiosha,Clothing,Women's Clothing
Bombay High Women's Solid Formal Shirt,Slim,Clothing,Women's Clothing
Westhreads Women's Solid Casual Shirt,Relaxed,Clothing,Women's Clothing
Meira Women's Printed Party Shirt,Regular Fit,Clothing,Women's Clothing
Anasazi Women's Printed Casual Shirt,Regular,Clothing,Women's Clothing
Eves Pret A Porter Women's Solid Casual Linen Shirt,Regular,Clothing,Women's Clothing
Naisha Women's Printed Casual Shirt,Slim,Clothing,Women's Clothing
Goodwill Impex Women's Solid Casual Shirt,Regular Fit,Clothing,Women's Clothing
HSFS Women's Printed Casual Shirt,Regular,Clothing,Women's Clothing
Shoppers Look Women's Solid Casual Shirt,Regular,Clothing,Women's Clothing
Miss Rich Women's Solid Casual Shirt,Regular,Clothing,Women's Clothing
Bombay High Women's Striped Formal Shirt,Slim,Clothing,Women's Clothing
HRX Women's Solid Casual Shirt,Regular Fit,Clothing,Women's Clothing
Antilia Femme Women's Printed Casual Reversible Shirt,Regular,Clothing,Women's Clothing
Folklore Women's Solid Festive Shirt,Regular,Clothing,Women's Clothing
MansiCollections Women's Solid Casual Shirt,Regular,Clothing,Women's Clothing
Harpa Women's Printed Casual Shirt,Regular Fit,Clothing,Women's Clothing
L'Elegantae Women's Solid Casual Shirt,Regular fit,Clothing,Women's Clothing
Jazzy Ben Women's Checkered Casual Shirt,Slim,Clothing,Women's Clothing
Blute Women's Solid Casual Shirt,Slim,Clothing,Women's Clothing
Anasazi Women's Solid Casual Shirt,Regular,Clothing,Women's Clothing
DeDe'S Women's Solid Casual Shirt,Regular,Clothing,Women's Clothing
People Women's Solid Formal Shirt,Regular,Clothing,Women's Clothing
Tokyo Talkies Women's Solid Casual Shirt,Regular,Clothing,Women's Clothing
Meira Women's Checkered Party Reversible Shirt,Regular,Clothing,Women's Clothing
Mustard Women's Solid Casual Shirt,Regular,Clothing,Women's Clothing
Folklore Women's Printed Festive Shirt,Slim Fit,Clothing,Women's Clothing
Jazzy Ben Women's Printed Casual Shirt,Regular,Clothing,Women's Clothing
Nexq Women's Solid Casual Shirt,Slim,Clothing,Women's Clothing
Teemoods Women's Solid Casual Shirt,Regular Fit,Clothing,Women's Clothing
Bombay High Women's Floral Print Casual Shirt,Regular,Clothing,Women's Clothing
People Women's Solid Casual Shirt,Regular,Clothing,Women's Clothing
Ishin Women's Solid Casual Shirt,Regular,Clothing,Women's Clothing
Ahhaaaa Women's Embroidered Casual Shirt,Regular,Clothing,Women's Clothing
Alibi By INMARK Women's Solid Casual Shirt,Regular Fit,Clothing,Women's Clothing
Galsgallery Women's Floral Print Casual Shirt,Slim,Clothing,Women's Clothing
Hermosear Women's Solid Casual Shirt,Slim,Clothing,Women's Clothing
Etti Women's Solid Casual Shirt,Regular,Clothing,Women's Clothing
Kasturi Women's Solid Casual Denim Shirt,Slim,Clothing,Women's Clothing
Tokyo Talkies Women's Checkered Casual Shirt,Slim,Clothing,Women's Clothing
My Addiction Women's Solid Casual Shirt,Regular,Clothing,Women's Clothing
Victorian Clothing Women's Printed Casual Shirt,Regular,Clothing,Women's Clothing
Kiosha Women's Solid Casual Shirt,Slim,Clothing,Women's Clothing
People Women's Printed Casual Shirt,Regular Fit,Clothing,Women's Clothing
Femella Women's Printed Casual Shirt,Regular,Clothing,Women's Clothing
Antilia Femme Women's Solid Casual Reversible Shirt,Regular,Clothing,Women's Clothing
We Desi Women's Solid Casual Reversible Shirt,Slim,Clothing,Women's Clothing
Fusion Women's Solid Casual Shirt,Regular,Clothing,Women's Clothing
My Addiction Women's Self Design Casual Shirt,Regular,Clothing,Women's Clothing
Being Fab Women's Solid Casual Shirt,Regular,Clothing,Women's Clothing
Lee Cooper Women's Printed Casual Shirt,Slim Fit,Clothing,Women's Clothing
Hyipe Women's Floral Print Casual Shirt,Slim,Clothing,Women's Clothing
Ebry Women's Printed Casual Shirt,Regular,Clothing,Women's Clothing
Kasturi Women's Checkered Casual Shirt,Slim,Clothing,Women's Clothing
Lynda Women's Solid Casual Shirt,Slim,Clothing,Women's Clothing
Lee Cooper Women's Checkered Casual Shirt,Slim Fit,Clothing,Women's Clothing
Nineteen Women's Solid Casual Shirt,Regular,Clothing,Women's Clothing
"Femninora Women's Solid Casual, Formal Shirt",Regular,Clothing,Women's Clothing
Tokyo Talkies Women's Printed Casual Shirt,Regular,Clothing,Women's Clothing
Bombay High Women's Printed Formal Shirt,Slim,Clothing,Women's Clothing
Life by Shoppers Stop Women's Solid Casual Shirt,Regular,Clothing,Women's Clothing
Fbbic Women's Printed Casual Shirt,Slim,Clothing,Women's Clothing
India Inc Women's Solid Casual Shirt,Slim,Clothing,Women's Clothing
Meee Women's Solid Casual Shirt,Regular Fit,Clothing,Women's Clothing
Eves Pret A Porter Women's Solid Casual Shirt,Slim,Clothing,Women's Clothing
Trend Arrest Women's Striped Casual Shirt,Regular,Clothing,Women's Clothing
India Inc Women's Polka Print Casual Shirt,Slim,Clothing,Women's Clothing
C M Clothing Women's Printed Casual Shirt,Realx Fit,Clothing,Women's Clothing
ORANGE PLUM Women's Printed Casual Shirt,Plus,Clothing,Women's Clothing
Orange Plum Women's Printed Casual Shirt,Regular,Clothing,Women's Clothing
Liba Women's Printed Casual Shirt,Regular,Clothing,Women's Clothing
Cottinfab Women's Checkered Casual Shirt,Regular Fit,Clothing,Women's Clothing
Bedazzle Women's Animal Print Casual Shirt,Regular,Clothing,Women's Clothing
Silly People Women's Solid Casual Shirt,Regular Fit,Clothing,Women's Clothing
Cool Quotient Women's Solid Casual Shirt,Regular,Clothing,Women's Clothing
From the Ramp Women's Printed Casual Shirt,Regular,Clothing,Women's Clothing
Cherymoya Women's Solid Casual Shirt,Regular,Clothing,Women's Clothing
Avenster Women's Solid Casual Shirt,Slim,Clothing,Women's Clothing
Entease Women's Solid Casual Shirt,regular,Clothing,Women's Clothing
Blenni Women's Solid Casual Shirt,Slim,Clothing,Women's Clothing
Dinero Women's Solid Casual Shirt,Casual,Clothing,Women's Clothing
Kaaryah Women's Striped Formal Shirt,Slim,Clothing,Women's Clothing
Leafe Women's Printed Casual Shirt,Slim,Clothing,Women's Clothing
Wisstler Women's Floral Print Casual Shirt,Regular,Clothing,Women's Clothing
Harpa Women's Solid Party Shirt,Regular,Clothing,Women's Clothing
Oxolloxo Women's Solid Party Shirt,Regular,Clothing,Women's Clothing
India Inc Women's Floral Print Casual Shirt,Regular,Clothing,Women's Clothing
Meira Women's Striped Party Reversible Shirt,Regular,Clothing,Women's Clothing
NGT Women's Solid Formal Shirt,Regular Fit,Clothing,Women's Clothing
Lamora Women's Solid Casual Shirt,Regular Fit,Clothing,Women's Clothing
Goodwill Impex Women's Printed Casual Shirt,Regular,Clothing,Women's Clothing
Gmi Women's Solid Casual Shirt,Slim,Clothing,Women's Clothing
Ishin Women's Solid Party Shirt,Slim,Clothing,Women's Clothing
Orange Plum Women's Floral Print Casual Shirt,Regular,Clothing,Women's Clothing
Bombay High Women's Polka Print Formal Shirt,Slim,Clothing,Women's Clothing
From the Ramp Women's Solid Casual Shirt,Regular,Clothing,Women's Clothing
Dinero Women's Solid Casual Reversible Shirt,Slim,Clothing,Women's Clothing
My Addiction Women's Geometric Print Casual Shirt,Regular,Clothing,Women's Clothing
Anasazi Women's Floral Print Casual Shirt,Regular,Clothing,Women's Clothing
Kcrimson Women's Checkered Casual Shirt,Slim,Clothing,Women's Clothing
Ruhaan's Women's Printed Casual Shirt,Regular Fit,Clothing,Women's Clothing
Eva De Moda Women's Graphic Print Casual Shirt,Regular,Clothing,Women's Clothing
People Women's Checkered Casual Shirt,Regular,Clothing,Women's Clothing
Kaaryah Women's Printed Casual Shirt,Slim,Clothing,Women's Clothing
Vama Women's Polka Print Casual Shirt,Slim,Clothing,Women's Clothing
GoodwillImpex Women's Solid Casual Shirt,Regular,Clothing,Women's Clothing
Mask Lifestyle Women's Printed Casual Shirt,Slim,Clothing,Women's Clothing
Fabpoppy Women's Printed Casual Shirt,Regular,Clothing,Women's Clothing
Lee Cooper Women's Solid Casual Shirt,Slim Fit,Clothing,Women's Clothing
Pankhuri For Women Women's Floral Print Casual Shirt,Slim,Clothing,Women's Clothing
BPT Women's Printed Casual Shirt,Slim,Clothing,Women's Clothing
India Inc Women's Printed Casual Shirt,Regular Fit,Clothing,Women's Clothing
Clo Clu Women's Solid Casual Shirt,Slim,Clothing,Women's Clothing
Faireno Women's Printed Casual Shirt,Slim,Clothing,Women's Clothing
Aimeon Women's Solid Casual Shirt,Regular,Clothing,Women's Clothing
Miss Rich Women's Graphic Print Casual Shirt,Regular,Clothing,Women's Clothing
Anasazi Women's Animal Print Casual Shirt,Regular,Clothing,Women's Clothing
Gmi Women's Self Design Casual Shirt,Regular,Clothing,Women's Clothing
Duvi Women's Floral Print Casual Shirt,Slim,Clothing,Women's Clothing
