name,brand,category1,category2
Roadster Men's Zipper Solid Cardigan,Roadster,Clothing,Men's Clothing
Discountgod Men's Checkered Casual Shirt,Slim,Clothing,Men's Clothing
Silver Streak Men's Printed Casual Denim Shirt,Slim,Clothing,Men's Clothing
Reckler Slim Fit Men's Jeans,Slim,Clothing,Men's Clothing
Wrangler Skanders Fit Men's Jeans,Skanders,Clothing,Men's Clothing
Wrangler Regular Fit Men's Jeans,Regular,Clothing,Men's Clothing
NE Regular Fit Men's Jeans,Regular,Clothing,Men's Clothing
Roadster Skinny Fit Fit Men's Jeans,Skinny Fit,Clothing,Men's Clothing
Traditions Printed Protective Men's Gloves,Traditions,Clothing,Men's Clothing
Wake Up Competition Full Sleeve Striped Men's Sweatshirt,Wake Up Competition,Clothing,Men's Clothing
Mizuno Lightweight Hoody Solid Men's Wind Cheater,Mizuno,Clothing,Men's Clothing
Van Heusen Men's Printed Party Shirt,Slim,Clothing,Men's Clothing
Fashion Tree Men's Solid Formal Shirt,Slim,Clothing,Men's Clothing
Peter England Men's Solid Formal Shirt,Slim,Clothing,Men's Clothing
Lee Mark Men's Solid Formal Shirt,Slim,Clothing,Men's Clothing
Status Quo Men's Solid Casual Shirt,Regular Fit,Clothing,Men's Clothing
Parron Men's Solid Casual Shirt,Slim,Clothing,Men's Clothing
Parron Men's Printed Casual Shirt,Slim,Clothing,Men's Clothing
American-Elm Solid Men's Waistcoat,American-Elm,Clothing,Men's Clothing
Raymond Checkered Men's Waistcoat,Raymond,Clothing,Men's Clothing
Rainfun Solid Men's Raincoat,Rainfun,Clothing,Men's Clothing
Mode Men's Floral Print Crew Length Socks,Mode,Clothing,Men's Clothing
prored Men's Printed No Show Socks,prored,Clothing,Men's Clothing
BURDY Graphic Print Men's Polo Neck Dark Blue T-Shirt,BURDY,Clothing,Men's Clothing
DOUBLE HORSE Men's Solid No Show Socks,DOUBLE HORSE,Clothing,Men's Clothing
Adidas Solid Men's Track Top,Adidas,Clothing,Men's Clothing
I Know Men's Solid Casual Dark Blue Shirt,I Know,Clothing,Men's Clothing
Ennoble Slim Fit Men's Grey Trousers,Ennoble,Clothing,Men's Clothing
Candy House Solid Men's Polo Neck T-Shirt,Candy House,Clothing,Men's Clothing
Speedo Men's Swimsuit,Speedo,Clothing,Men's Clothing
Raymond Men's Printed Formal Blue Shirt,Raymond,Clothing,Men's Clothing
Selfcare Men's Brief,Selfcare,Clothing,Men's Clothing
RAA Men's Brief,RAA,Clothing,Men's Clothing
Dispowear Men's Brief,Dispowear,Clothing,Men's Clothing
Finger's Printed Men's Track Pants,Finger's,Clothing,Men's Clothing
TAMBAS Solid Men's Track Pants,TAMBAS,Clothing,Men's Clothing
GREENWICH Solid Men's Track Pants,GREENWICH,Clothing,Men's Clothing
ferari Men's Solid Casual Yellow Shirt,ferari,Clothing,Men's Clothing
Voylla Artificial Classic Plain Yellow Gold Cubic Zirconia Alloy Pendant,Voylla,Clothing,Men's Clothing
CREEDS Men's Printed Casual Multicolor Shirt,CREEDS,Clothing,Men's Clothing
Calvin Klein Men's Solid Casual White Shirt,Calvin Klein,Clothing,Men's Clothing
KAVACi Full Sleeve Solid Men's Jacket,KAVACi,Clothing,Men's Clothing
Voylla Artificial Classic Plain Rose Gold Alloy Pendant,Voylla,Clothing,Men's Clothing
HugMe.fashion Full Sleeve Striped Men's Jacket,HugMe.fashion,Clothing,Men's Clothing
Royal Men's Kurta and Pyjama Set,Royal,Clothing,Men's Clothing
Alark The Ethnic Men's Kurta and Pyjama Set,Alark The Ethnic,Clothing,Men's Clothing
Royal Men's Pathani Suit Set,Royal,Clothing,Men's Clothing
BODYSENSE Men's Vest,BODYSENSE,Clothing,Men's Clothing
Odoky Men's Vest,Odoky,Clothing,Men's Clothing
Fanideaz Printed Men's Round Neck Grey T-Shirt,Fanideaz,Clothing,Men's Clothing
craftland Solid Tie,craftland,Clothing,Men's Clothing
Status Quo Solid Men's Track Pants,Status Quo,Clothing,Men's Clothing
Denim 86 Slim Fit Men's Jeans,Denim 86,Clothing,Men's Clothing
SAVON Slim Fit Men's Jeans,SAVON,Clothing,Men's Clothing
Hangrr Premium Single Breasted Solid Men's Suit,Hangrr,Clothing,Men's Clothing
Maveric Pleasing Single Breasted Solid Men's Suit,Maveric,Clothing,Men's Clothing
Brahaan BLUE TAG Single Breasted Solid Men's Suit,Brahaan BLUE TAG,Clothing,Men's Clothing
The Design Factory Single Breasted Solid Men's Suit,The Design Factory,Clothing,Men's Clothing
Tatkim Single Breasted Solid Men's Suit,Tatkim,Clothing,Men's Clothing
Richard Cole Mandarin Solid Men's Suit,Richard Cole,Clothing,Men's Clothing
Livastar Men's Solid Casual Blue Shirt,Livastar,Clothing,Men's Clothing
Cotton World Men's Solid Casual Linen White Shirt,Cotton World,Clothing,Men's Clothing
"ARISE Self Design, Printed Men's Henley Maroon T-Shirt",ARISE,Clothing,Men's Clothing
"ARISE Self Design, Printed Men's Henley Green T-Shirt",ARISE,Clothing,Men's Clothing
Reebok Men's Ankle Length Socks,Reebok,Clothing,Men's Clothing
Mayor Men's Crew Length Socks,Mayor,Clothing,Men's Clothing
Mayor Men's Mid-calf Length Socks,Mayor,Clothing,Men's Clothing
Mayor Men's Ankle Length Socks,Mayor,Clothing,Men's Clothing
SUNPLEON Men's Mid-calf Length Socks,SUNPLEON,Clothing,Men's Clothing
o.h.m Solid Men's Black Track Pants,o.h.m,Clothing,Men's Clothing
Hubberholme Solid Men's Dark Blue Track Pants,Hubberholme,Clothing,Men's Clothing
Magideal Men's Brief,Magideal,Clothing,Men's Clothing
LUX Men's Brief,LUX,Clothing,Men's Clothing
R-Lon Men's Brief,R-Lon,Clothing,Men's Clothing
Calvin Klein Men's Brief,Calvin Klein,Clothing,Men's Clothing
Romano Full Sleeve Striped Men's Sweatshirt,Romano,Clothing,Men's Clothing
ISHWA Full Sleeve Graphic Print Men's Sweatshirt,ISHWA,Clothing,Men's Clothing
PALSUN WEARS Full Sleeve Striped Men's Sweatshirt,PALSUN WEARS,Clothing,Men's Clothing
HugMe.fashion Full Sleeve Solid Men's Jacket,HugMe.fashion,Clothing,Men's Clothing
Autokartindia Full Sleeve Solid Men's Jacket,Autokartindia,Clothing,Men's Clothing
See Designs Men's Printed Casual Shirt,Slim Fit,Clothing,Men's Clothing
London Bee Men's Printed Casual Shirt,Regular,Clothing,Men's Clothing
Revine Men's Printed Casual Shirt,Slim,Clothing,Men's Clothing
WROGN Men's Solid Casual Shirt,Slim,Clothing,Men's Clothing
o.h.m Solid Round Neck Casual Men's Sweater,o.h.m,Clothing,Men's Clothing
Jack & Jones Printed Men's Round Neck T-Shirt,Jack & Jones,Clothing,Men's Clothing
Magneto Printed Men's Boxer,Magneto,Clothing,Men's Clothing
At Ur Door Men's Printed Bandana,At Ur Door,Clothing,Men's Clothing
killys Men's Solid No Show Socks,killys,Clothing,Men's Clothing
HANS Men's Crew Length Socks,HANS,Clothing,Men's Clothing
Reebok Solid Men's Three Fourths,Reebok,Clothing,Men's Clothing
Selfiwear Printed Cotton Men's Stole,Selfiwear,Clothing,Men's Clothing
TSG Escape Printed Men's Round Neck Multicolor T-Shirt,TSG Escape,Clothing,Men's Clothing
Sprint Men's Checkered Formal Shirt,Regular,Clothing,Men's Clothing
Van Heusen Men's Striped Formal Shirt,Regular,Clothing,Men's Clothing
Highlander Men's Solid Casual Shirt,Slim,Clothing,Men's Clothing
Highlander Men's Printed Casual Shirt,Slim Fit,Clothing,Men's Clothing
Silver Streak Men's Printed Casual Shirt,Slim,Clothing,Men's Clothing
Royal Enfield Men's Graphic Print Bandana,Royal Enfield,Clothing,Men's Clothing
Shaftesbury London Men's Solid Formal Shirt,Shaftesbury London,Clothing,Men's Clothing
Stylenara Men's Solid Casual Shirt,Stylenara,Clothing,Men's Clothing
Shaftesbury London Men's Striped Formal Shirt,Shaftesbury London,Clothing,Men's Clothing
F Factor by Pantaloons Men's Solid Formal Shirt,Slim Fit,Clothing,Men's Clothing
Baaamboos Men's Solid Formal Shirt,Regular,Clothing,Men's Clothing
Blackberrys Men's Solid Formal Shirt,Slim,Clothing,Men's Clothing
Richworth Men's Solid Formal Shirt,Regular,Clothing,Men's Clothing
Puma Men's Striped Casual Shirt,Slim Fit,Clothing,Men's Clothing
baaamboos Men's Solid Formal Shirt,Regular,Clothing,Men's Clothing
Oxemberg Men's Solid Formal Shirt,Slim,Clothing,Men's Clothing
D'INDIAN CLUB Men's Solid Formal Shirt,Smart Fit,Clothing,Men's Clothing
Goodkarma Men's Self Design Casual Shirt,Goodkarma,Clothing,Men's Clothing
Marc N' Park Men's Solid Casual Shirt,Marc N' Park,Clothing,Men's Clothing
Ebry Men's Checkered Casual Shirt,Ebry,Clothing,Men's Clothing
Goodkarma Men's Printed Casual Shirt,Goodkarma,Clothing,Men's Clothing
Marc N' Park Men's Printed Casual Shirt,Marc N' Park,Clothing,Men's Clothing
Ebry Men's Printed Casual Shirt,Ebry,Clothing,Men's Clothing
Pavino Men's Solid Casual Shirt,Pavino,Clothing,Men's Clothing
"DENIM CAFE Slim Fit Men's Blue, Dark Blue Jeans",DENIM CAFE,Clothing,Men's Clothing
Flying Port Slim Fit Men's Blue Jeans,Flying Port,Clothing,Men's Clothing
Hoffmen Men's Self Design Formal Shirt,Hoffmen,Clothing,Men's Clothing
John Players Men's Checkered Formal Shirt,John Players,Clothing,Men's Clothing
Speedo Monogram Aquashort Graphic Print Men's,Speedo,Clothing,Men's Clothing
Rossini Striped Tie,Rossini,Clothing,Men's Clothing
SWARN Solid Tie,SWARN,Clothing,Men's Clothing
Clareo Checkered Tie,Clareo,Clothing,Men's Clothing
Paranoid Checkered Tie,Paranoid,Clothing,Men's Clothing
PurePlay Men's Track Top,PurePlay,Clothing,Men's Clothing
Cotts Hub Cotton Polyester Blend Solid Shirt Fabric,Cotts Hub,Clothing,Men's Clothing
L'appel Du vide Men's Vest,L'appel Du vide,Clothing,Men's Clothing
Finger's Solid Men's Track Pants,Finger's,Clothing,Men's Clothing
Quiksilver Solid Men's Track Pants,Quiksilver,Clothing,Men's Clothing
Vector X Men's Track Pants,Vector X,Clothing,Men's Clothing
I-Voc Men's Printed Casual Shirt,Slim,Clothing,Men's Clothing
Andrew Christian Men's Brief,Andrew Christian,Clothing,Men's Clothing
LefJord Men's Ankle Length Socks,LefJord,Clothing,Men's Clothing
Texlon Men's Mid-calf Length Socks,Texlon,Clothing,Men's Clothing
Texlon Men's Ankle Length Socks,Texlon,Clothing,Men's Clothing
King George V Men's Brief,King George V,Clothing,Men's Clothing
Zobello Slim Fit Men's Grey Trousers,Zobello,Clothing,Men's Clothing
ColorPlus Slim Fit Men's Black Trousers,ColorPlus,Clothing,Men's Clothing
Park Avenue Regular Fit Men's Brown Trousers,Park Avenue,Clothing,Men's Clothing
Aadishwar Creations Solid Protective Men's Gloves,Aadishwar Creations,Clothing,Men's Clothing
"Cotson Solid Protective Men's, Women's Gloves",Cotson,Clothing,Men's Clothing
KRAZY KATZ Solid Men's Round Neck T-Shirt,KRAZY KATZ,Clothing,Men's Clothing
Ethiic Sleeveless Self Design Men's Jacket,Ethiic,Clothing,Men's Clothing
SKOOKIE Sleeveless Solid Men's Jacket,SKOOKIE,Clothing,Men's Clothing
HRX by Hrithik Roshan Full Sleeve Printed Men's Jacket,HRX by Hrithik Roshan,Clothing,Men's Clothing
Provogue Slim Fit Men's Jeans,Slim,Clothing,Men's Clothing
Gasket Slim fit Fit Men's Jeans,Slim fit,Clothing,Men's Clothing
Powell Slim Fit Men's Jeans,Slim,Clothing,Men's Clothing
Jack & Jones Slim Fit Men's Jeans,Slim,Clothing,Men's Clothing
Police Slim Fit Men's Jeans,Slim,Clothing,Men's Clothing
Pecanz Men's Printed Casual Shirt,Slim,Clothing,Men's Clothing
PXL Men's Solid Formal Shirt,Slim,Clothing,Men's Clothing
Pecanz Men's Striped Casual Denim Shirt,Slim,Clothing,Men's Clothing
GHPC Men's Checkered Casual Denim Shirt,Slim,Clothing,Men's Clothing
Zobello Men's Checkered Casual Shirt,Standard Fit,Clothing,Men's Clothing
Gas Slim Fit Men's Jeans,Slim,Clothing,Men's Clothing
Marks & Spencer Self Design Round Neck Casual Men's Sweater,Marks & Spencer,Clothing,Men's Clothing
Nautica Striped Round Neck Casual Men's Sweater,Nautica,Clothing,Men's Clothing
Romano Striped Scoop Neck Casual Men's Sweater,Romano,Clothing,Men's Clothing
Nautica Solid Turtle Neck Casual Men's Sweater,Nautica,Clothing,Men's Clothing
KazamaKraft Full Sleeve Solid Men's Jacket,KazamaKraft,Clothing,Men's Clothing
SayItLoud Full Sleeve Solid Men's Sweatshirt,SayItLoud,Clothing,Men's Clothing
Wake Up Competition Full Sleeve Solid Men's Sweatshirt,Wake Up Competition,Clothing,Men's Clothing
Specimen Men's Solid Casual Shirt,Slim,Clothing,Men's Clothing
Specimen Men's Solid Formal Shirt,Slim,Clothing,Men's Clothing
Mr Button Men's Solid Casual Linen Shirt,Slim Fit,Clothing,Men's Clothing
Silver Streak Men's Checkered Casual Shirt,Slim,Clothing,Men's Clothing
Orange Valley Men's Solid Casual Shirt,Slim,Clothing,Men's Clothing
Orange Valley Men's Checkered Casual Shirt,Slim,Clothing,Men's Clothing
Orange Valley Men's Printed Casual Shirt,Slim,Clothing,Men's Clothing
chamanhandicrafts Men's Checkered Casual Shirt,chamanhandicrafts,Clothing,Men's Clothing
Black Bee Men's Solid Casual Shirt,Black Bee,Clothing,Men's Clothing
Sleek Line Men's Checkered Casual Shirt,Sleek Line,Clothing,Men's Clothing
Elligator Solid Men's Three Fourths,Elligator,Clothing,Men's Clothing
Lance Solid Men's Three Fourths,Lance,Clothing,Men's Clothing
Reinforce Solid Men's Three Fourths,Reinforce,Clothing,Men's Clothing
DFH Solid Men's Three Fourths,DFH,Clothing,Men's Clothing
Leaf Men's Solid Formal Shirt,Regular,Clothing,Men's Clothing
Karsci Men's Solid Lounge Wear Shirt,Slim,Clothing,Men's Clothing
Kalrav Men's Solid Formal Shirt,Regular,Clothing,Men's Clothing
Jainish Men's Solid Formal Shirt,Regular,Clothing,Men's Clothing
J Hampstead Men's Solid Formal Shirt,Regular,Clothing,Men's Clothing
JadeBlue Men's Self Design Formal Linen Shirt,Regular,Clothing,Men's Clothing
Just Differ Men's Polka Print Formal Shirt,Trim,Clothing,Men's Clothing
Indian Weller Men's Woven Formal Linen Shirt,Regular,Clothing,Men's Clothing
JadeBlue Men's Solid Formal Shirt,Regular,Clothing,Men's Clothing
INVICTUS Men's Checkered Formal Linen Shirt,Slim,Clothing,Men's Clothing
Kiaraa Men's Solid Formal Shirt,Regular,Clothing,Men's Clothing
Inmark Men's Checkered Formal Shirt,Regular,Clothing,Men's Clothing
"Jorzzer Roniya Men's Solid Formal, Party, Wedding, Casual, Festive Shirt",Regular,Clothing,Men's Clothing
Jain's Men's Solid Formal Shirt,Regular,Clothing,Men's Clothing
J Hampstead Men's Checkered Formal Shirt,Regular,Clothing,Men's Clothing
Just Differ Men's Striped Formal Shirt,Trim,Clothing,Men's Clothing
Lamode Men's Solid Formal Shirt,Regular,Clothing,Men's Clothing
Kingswood Men's Striped Formal Shirt,Slim,Clothing,Men's Clothing
Karlsburg Men's Self Design Formal Shirt,Regular,Clothing,Men's Clothing
Jaabili Men's Solid Formal Shirt,Regular,Clothing,Men's Clothing
"Jads Men's Printed Casual, Lounge Wear, Party Shirt",Slim,Clothing,Men's Clothing
Lee Marc Men's Solid Formal Denim Shirt,Slim,Clothing,Men's Clothing
Jermyn Crest Men's Checkered Formal Shirt,Slim,Clothing,Men's Clothing
Kristino Men's Solid Formal Shirt,Regular,Clothing,Men's Clothing
Koolpals Men's Checkered Formal Shirt,Regular,Clothing,Men's Clothing
Jake Chiramel Men's Solid Formal Shirt,Regular,Clothing,Men's Clothing
Jogur Men's Checkered Formal Shirt,Slim,Clothing,Men's Clothing
Kingswood Men's Solid Formal Shirt,Slim,Clothing,Men's Clothing
John Morris Men's Striped Formal Shirt,Slim,Clothing,Men's Clothing
Invictus Men's Solid Formal Shirt,Slim,Clothing,Men's Clothing
J Marks Men's Striped Formal Shirt,Regular,Clothing,Men's Clothing
Inmark Men's Solid Formal Shirt,Slim,Clothing,Men's Clothing
Inmark Men's Striped Formal Shirt,Regular,Clothing,Men's Clothing
Karlsburg Men's Solid Formal Shirt,Regular,Clothing,Men's Clothing
Keystone Men's Solid Formal Shirt,Slim Fit,Clothing,Men's Clothing
Kingswood Men's Self Design Formal Shirt,Slim Fit,Clothing,Men's Clothing
Kalpatru Men's Checkered Formal Shirt,Regular Fit,Clothing,Men's Clothing
J Marks Men's Checkered Formal Shirt,Slim,Clothing,Men's Clothing
La Mode Men's Checkered Formal Linen Shirt,Regular,Clothing,Men's Clothing
Karsci Men's Solid Formal Shirt,Slim,Clothing,Men's Clothing
Jovial Mart Store Men's Solid Formal Shirt,Slim,Clothing,Men's Clothing
Jpeters Men's Solid Formal Shirt,Regular,Clothing,Men's Clothing
INVICTUS Men's Solid Formal Shirt,Slim,Clothing,Men's Clothing
Ishin Men's Striped Formal Shirt,Slim,Clothing,Men's Clothing
Lee Marc Men's Checkered Formal Shirt,Slim,Clothing,Men's Clothing
Japs Men's Solid Formal Linen Shirt,Regular Fit,Clothing,Men's Clothing
Kayara Collection Men's Striped Formal Shirt,Regular,Clothing,Men's Clothing
Jogur Men's Solid Formal Shirt,Slim,Clothing,Men's Clothing
Kraasa Men's Solid Formal Shirt,Regular,Clothing,Men's Clothing
Ishin Men's Solid Formal Shirt,Slim,Clothing,Men's Clothing
Kirubha Tex Men's Solid Formal Shirt,Slim,Clothing,Men's Clothing
Just Differ Men's Self Design Formal Shirt,Trim,Clothing,Men's Clothing
Indian Terrain Men's Striped Formal Shirt,Slim Fit,Clothing,Men's Clothing
Koridor Men's Solid Formal Shirt,Slim,Clothing,Men's Clothing
LEAF Men's Solid Formal Shirt,Regular,Clothing,Men's Clothing
INVICTUS Men's Checkered Formal Shirt,Slim,Clothing,Men's Clothing
Lamode Men's Checkered Formal Shirt,Regular,Clothing,Men's Clothing
Noise Men's Printed Bandana,Noise,Clothing,Men's Clothing
L'appel Du Vide Men's Vest,L'appel Du Vide,Clothing,Men's Clothing
Okane Solid Men's Three Fourths,Okane,Clothing,Men's Clothing
FRICTION Men's Vest,FRICTION,Clothing,Men's Clothing
Zacharias Men's Vest,Zacharias,Clothing,Men's Clothing
SM Nutrition Men's Vest,SM Nutrition,Clothing,Men's Clothing
American Swan V-neck Solid Men's Pullover,American Swan,Clothing,Men's Clothing
Monte Carlo Round Neck Printed Men's Pullover,Monte Carlo,Clothing,Men's Clothing
V3Squared V-neck Solid Men's Pullover,V3Squared,Clothing,Men's Clothing
Day By Day Men's Top,Day By Day,Clothing,Men's Clothing
Antshrike Men's Pyjama,Antshrike,Clothing,Men's Clothing
Clickroo Men's Pyjama,Clickroo,Clothing,Men's Clothing
Lux Inferno Men's Top,Lux Inferno,Clothing,Men's Clothing
GM Regular Fit Men's Silver Trousers,GM,Clothing,Men's Clothing
TruSo Slim Fit Men's Beige Trousers,TruSo,Clothing,Men's Clothing
Demokrazy Solid Men's Maroon Track Pants,Demokrazy,Clothing,Men's Clothing
GM Regular Fit Men's Black Trousers,GM,Clothing,Men's Clothing
"69th Avenue 69SS0002-X1 Polyester, Steel Sliding Pin Shirt Stud",69th Avenue,Clothing,Men's Clothing
Ashdan Sleeveless Solid Men's Sweatshirt,Ashdan,Clothing,Men's Clothing
Champ Solid Men's Swimming Long Shorts Tights,Champ,Clothing,Men's Clothing
UNCLE BENIT WOOLEN CAP Cap,UNCLE BENIT,Clothing,Men's Clothing
IndiWeaves Solid Men's Grey Track Pants,IndiWeaves,Clothing,Men's Clothing
Hubberholme Solid Men's Grey Track Pants,Hubberholme,Clothing,Men's Clothing
UNCLE BENIT MONKEY CAP Cap,UNCLE BENIT,Clothing,Men's Clothing
"IndiWeaves Solid Men's Blue, Brown Track Pants",IndiWeaves,Clothing,Men's Clothing
Hubberholme Solid Men's Red Track Pants,Hubberholme,Clothing,Men's Clothing
KRiSS Men's Solid Formal Linen Blue Shirt,KRiSS,Clothing,Men's Clothing
V-AARCI Men's Vest,V-AARCI,Clothing,Men's Clothing
SAYITLOUD Men's Vest,SAYITLOUD,Clothing,Men's Clothing
Osmonde Men's Vest,Osmonde,Clothing,Men's Clothing
"IndiWeaves Regular Fit Men's Linen Brown, Blue Trousers",IndiWeaves,Clothing,Men's Clothing
Royal Men's Kurta and Churidar Set,Royal,Clothing,Men's Clothing
Body Care Plain Men's Pyjama,Body Care,Clothing,Men's Clothing
Body Care Plain Men's Top,Body Care,Clothing,Men's Clothing
Khaan Saab Editions Woven Sherwani,Khaan Saab Editions,Clothing,Men's Clothing
"IndiWeaves Regular Fit Men's Linen White, Black Trousers",IndiWeaves,Clothing,Men's Clothing
"IndiWeaves Regular Fit Men's Linen Beige, Blue Trousers",IndiWeaves,Clothing,Men's Clothing
Roadster Men's Checkered Casual Grey Shirt,Roadster,Clothing,Men's Clothing
Zobello Men's Checkered Casual Multicolor Shirt,Zobello,Clothing,Men's Clothing
Zobello Men's Checkered Casual White Shirt,Zobello,Clothing,Men's Clothing
Zobello Men's Striped Casual Multicolor Shirt,Zobello,Clothing,Men's Clothing
Wajbee Solid Men's Black Track Pants,Wajbee,Clothing,Men's Clothing
Scot Wilson Men's Checkered Casual Shirt,Scot Wilson,Clothing,Men's Clothing
"IndiWeaves Regular Fit Men's Linen White, Cream Trousers",IndiWeaves,Clothing,Men's Clothing
EASIES Solid Single Breasted Casual Men's Blazer,EASIES,Clothing,Men's Clothing
Romano Solid Single Breasted Formal Men's Blazer,Romano,Clothing,Men's Clothing
Blackberrys Self Design Single Breasted Party Men's Blazer,Blackberrys,Clothing,Men's Clothing
Blackberrys Solid Single Breasted Casual Men's Blazer,Blackberrys,Clothing,Men's Clothing
"BACHELORS N BEYOND Self Design Single Breasted Festive, Festive, Casual Men's Blazer",BACHELORS N BEYOND,Clothing,Men's Clothing
"blue stag Self Design Single Breasted Wedding, Casual, Party Men's Blazer",blue stag,Clothing,Men's Clothing
"Van Don Solid Single Breasted Casual, Party, Wedding Men's Blazer",Van Don,Clothing,Men's Clothing
Sting Solid Single Breasted Casual Men's Blazer,Sting,Clothing,Men's Clothing
Blackberrys Printed Single Breasted Casual Men's Blazer,Blackberrys,Clothing,Men's Clothing
TOC Self Design Single Breasted Festive Men's Blazer,TOC,Clothing,Men's Clothing
Romano Checkered Single Breasted Formal Men's Blazer,Romano,Clothing,Men's Clothing
"blue stag Self Design Tuxedo Style Wedding, Casual, Casual Men's Blazer",blue stag,Clothing,Men's Clothing
"Menjestic Solid Tuxedo Style Wedding, Casual, Party Men's Blazer",Menjestic,Clothing,Men's Clothing
Blackberrys Self Design Single Breasted Formal Men's Blazer,Blackberrys,Clothing,Men's Clothing
FTCBAZAR Solid Men's Straight Kurta,FTCBAZAR,Clothing,Men's Clothing
JHON DIEGO Viscose Self Design Suit Fabric,JHON DIEGO,Clothing,Men's Clothing
FreeHand Solid Men's Straight Kurta,FreeHand,Clothing,Men's Clothing
Yepme Embroidered Men's A-line Kurta,Yepme,Clothing,Men's Clothing
Royal Kurta Men's Pathani Suit Set,Royal Kurta,Clothing,Men's Clothing
Anuze Fashions Checkered viscose Men's,Anuze Fashions,Clothing,Men's Clothing
"69th Avenue 69SS0003-B6 Polyester, Steel Sliding Pin Shirt Stud",69th Avenue,Clothing,Men's Clothing
Eccellente LPLFLWR3BK Cotton Sliding Pin Shirt Stud,Eccellente,Clothing,Men's Clothing
Pazel Slim Fit Men's Jeans,Pazel,Clothing,Men's Clothing
Alisha Solid Women's Cycling Shorts,Alisha,Clothing,Women's Clothing
Carrel Printed Women's,Carrel,Clothing,Women's Clothing
Indcrown Net Embroidered Semi-stitched Lehenga Choli Material,Indcrown,Clothing,Women's Clothing
KAJCI Embroidered Women's Waistcoat,KAJCI,Clothing,Women's Clothing
Pick Pocket Embroidered Women's Waistcoat,Pick Pocket,Clothing,Women's Clothing
Mario Gotze Women's Printed Casual Orange Shirt,Mario Gotze,Clothing,Women's Clothing
Eccellente Solid Hip Hop Cap,Eccellente,Clothing,Women's Clothing
Momin Libas AK2414 Kashibo Solid Abaya No,Momin Libas,Clothing,Women's Clothing
"Great Art Floral Print Wool, Viscose, 20% Kashmiri wool, 50% Cashmilon and 30% Wool ruffle yarn Women's Stole",Great Art,Clothing,Women's Clothing
Jayanti sarees Party Embroidered Women's Kurti,Jayanti sarees,Clothing,Women's Clothing
"Mynte Solid Women's Cycling Shorts, Gym Shorts, Swim Shorts",Mynte,Clothing,Women's Clothing
MERIL Casual Full Sleeve Printed Women's Top,MERIL,Clothing,Women's Clothing
INDRICKA Casual Butterfly Sleeve Solid Women's Top,INDRICKA,Clothing,Women's Clothing
Riot Jeans Casual Short Sleeve Printed Women's Top,Riot Jeans,Clothing,Women's Clothing
INDRICKA Casual Roll-up Sleeve Solid Women's Top,INDRICKA,Clothing,Women's Clothing
TAB91 Casual Short Sleeve Printed Women's Top,TAB91,Clothing,Women's Clothing
Selfiwear Casual 3/4 Sleeve Printed Women's Top,Selfiwear,Clothing,Women's Clothing
S9 WOMEN Casual Sleeveless Solid Women's Top,S9 WOMEN,Clothing,Women's Clothing
esoft Casual Short Sleeve Solid Women's Top,esoft,Clothing,Women's Clothing
esoft Casual Sleeveless Solid Women's Top,esoft,Clothing,Women's Clothing
esoft Casual 3/4 Sleeve Solid Women's Top,esoft,Clothing,Women's Clothing
Riot Jeans Casual Sleeveless Printed Women's Top,Riot Jeans,Clothing,Women's Clothing
INDRICKA Casual Full Sleeve Solid Women's Top,INDRICKA,Clothing,Women's Clothing
Riot Jeans Casual Sleeveless Floral Print Women's Top,Riot Jeans,Clothing,Women's Clothing
Wardtrobe Women's Fit and Flare Dress,Wardtrobe,Clothing,Women's Clothing
Mineral Women's Maxi Dress,Mineral,Clothing,Women's Clothing
Zastraa Women's Maxi Dress,Zastraa,Clothing,Women's Clothing
LA ATTIRE Women's A-line Dress,LA ATTIRE,Clothing,Women's Clothing
Abony Women's Gathered Dress,Abony,Clothing,Women's Clothing
Fabiya Women's Bikini Panty,Fabiya,Clothing,Women's Clothing
Amadore Women's Black Leggings,Amadore,Clothing,Women's Clothing
medha Women's Multicolor Leggings,medha,Clothing,Women's Clothing
"Tullis Women's Purple, Pink, Green, Blue, Red, Black Leggings",Tullis,Clothing,Women's Clothing
Avyak Women's White Leggings,Avyak,Clothing,Women's Clothing
"Tullis Women's White, Purple, Pink, Green, Blue, Green Leggings",Tullis,Clothing,Women's Clothing
"Dernier Wear Women's A-line White, Blue Dress",Dernier Wear,Clothing,Women's Clothing
Ajaero Women's Maxi Red Dress,Ajaero,Clothing,Women's Clothing
"Dernier Wear Women's A-line Black, White Dress",Dernier Wear,Clothing,Women's Clothing
Oranje Women's Fit and Flare Black Dress,Oranje,Clothing,Women's Clothing
Fabpoppy Women's Pyjama,Fabpoppy,Clothing,Women's Clothing
Lambency Women's Pyjama,Lambency,Clothing,Women's Clothing
BOLLYWOOD ACCESSORY Woven Viscose Women's Scarf,BOLLYWOOD ACCESSORY,Clothing,Women's Clothing
HSFS Printed Gorgette Women's Kaftan,HSFS,Clothing,Women's Clothing
W.A.Y Embellished Women's Jumpsuit,W.A.Y,Clothing,Women's Clothing
Lakos Women's Multicolor Leggings,Lakos,Clothing,Women's Clothing
Vastrani Casual Full Sleeve Printed Women's Top,Vastrani,Clothing,Women's Clothing
BONHEUR Casual 3/4 Sleeve Floral Print Women's Top,BONHEUR,Clothing,Women's Clothing
fashion bazar Self Design Women's Lehenga Choli,fashion bazar,Clothing,Women's Clothing
"Sohardhastshilp Self Design Women's Lehenga, Choli and Dupatta Set",Sohardhastshilp,Clothing,Women's Clothing
Philigree Casual 3/4 Sleeve Printed Women's Top,Philigree,Clothing,Women's Clothing
UMA TRADERS Cotton Embroidered Semi-stitched Salwar Suit Dupatta Material,UMA TRADERS,Clothing,Women's Clothing
UMA TRADERS Chanderi Embroidered Semi-stitched Salwar Suit Dupatta Material,UMA TRADERS,Clothing,Women's Clothing
VIHA Net Embroidered Semi-stitched Salwar Suit Dupatta Material,VIHA,Clothing,Women's Clothing
Reinvent Casual Short Sleeve Self Design Women's Top,Reinvent,Clothing,Women's Clothing
