name,brand,category1,category2
Lee Cooper Women's Floral Print Casual Shirt,Regular Fit,Clothing,Women's Clothing
Indiatrendzs Women's Printed Casual Shirt,Slim,Clothing,Women's Clothing
Dream Fashion Women's Printed Casual Shirt,Slim,Clothing,Women's Clothing
Mast & Harbour Women's Printed Casual Shirt,Regular,Clothing,Women's Clothing
Buenos Dias Women's Solid Casual Shirt,Regular,Clothing,Women's Clothing
"Kumi Women's Solid Casual, Festive, Party Shirt",Regular,Clothing,Women's Clothing
"Haute curry by Shoppers Stop Women's Solid, Woven Casual, Formal Shirt",Regular,Clothing,Women's Clothing
Kashana Fashions Women's Printed Casual Shirt,Regular,Clothing,Women's Clothing
Stilestreet Women's Printed Casual Shirt,Regular,Clothing,Women's Clothing
Harpa Women's Floral Print Casual Shirt,Regular Fit,Clothing,Women's Clothing
Avenster Women's Striped Casual Shirt,Slim,Clothing,Women's Clothing
Cottinfab Women's Solid Casual Shirt,Slim,Clothing,Women's Clothing
Sbuys Women's Striped Casual Shirt,Regular,Clothing,Women's Clothing
Ishin Designer Studio Women's Solid Casual Shirt,Regular,Clothing,Women's Clothing
Wisstler Women's Printed Casual Shirt,Regular,Clothing,Women's Clothing
People Women's Striped Formal Shirt,Regular,Clothing,Women's Clothing
Stilestreet Women's Animal Print Casual Shirt,Regular,Clothing,Women's Clothing
"StylElite Women's Solid Casual, Formal Shirt",Regular,Clothing,Women's Clothing
"Life by Shoppers Stop Women's Printed Casual, Formal Shirt",Regular,Clothing,Women's Clothing
Miss Rich Women's Striped Casual Shirt,Slim,Clothing,Women's Clothing
SbuyS Women's Solid Casual Shirt,Regular Fit,Clothing,Women's Clothing
Seeyaar Women's Floral Print Casual Shirt,Regular,Clothing,Women's Clothing
Sbuys Women's Checkered Casual Shirt,Regular,Clothing,Women's Clothing
Eves Pret A Porter Women's Printed Casual Shirt,Regular,Clothing,Women's Clothing
Meee Women's Solid Casual Reversible Shirt,Slim,Clothing,Women's Clothing
DressBerry Women's Solid Casual Shirt,Regular,Clothing,Women's Clothing
Kashana Fashions Women's Polka Print Casual Shirt,Regular,Clothing,Women's Clothing
Colsa Women's Printed Casual Shirt,Slim,Clothing,Women's Clothing
Naughty Bear Women's Solid Formal Shirt,Comfort,Clothing,Women's Clothing
Modimania Women's Checkered Casual Shirt,Regular Fit,Clothing,Women's Clothing
India Inc Women's Embroidered Casual Shirt,Slim,Clothing,Women's Clothing
Oxolloxo Women's Solid Casual Shirt,Regular Fit,Clothing,Women's Clothing
Hugo Chavez Women's Solid Casual Denim Shirt,Regular,Clothing,Women's Clothing
"F Fashion Stylus Women's Printed Casual, Formal Shirt",Slim,Clothing,Women's Clothing
Kasturi Women's Striped Casual Shirt,Slim,Clothing,Women's Clothing
Anasazi Women's Checkered Casual Shirt,Regular,Clothing,Women's Clothing
Colors Couture Women's Printed Casual Shirt,Slim Fit,Clothing,Women's Clothing
La Rochelle Women's Geometric Print Casual Reversible Shirt,Slim,Clothing,Women's Clothing
Abida Women's Checkered Casual Shirt,Slim,Clothing,Women's Clothing
Osumfab Women's Solid Casual Shirt,Regular,Clothing,Women's Clothing
Desigrrrl Women's Floral Print Casual Shirt,Regular,Clothing,Women's Clothing
Mayra Women's Solid Casual Shirt,Regular,Clothing,Women's Clothing
Picador Women's Polka Print Casual Shirt,Regular,Clothing,Women's Clothing
Zotw Women's Floral Print Casual Shirt,Regular,Clothing,Women's Clothing
Moh Maya Women's Floral Print Casual Shirt,Slim,Clothing,Women's Clothing
"Aarti Collections Women's Printed Casual, Festive, Party Shirt",Slim Fit,Clothing,Women's Clothing
Kcrimson Women's Printed Casual Shirt,Slim,Clothing,Women's Clothing
Fusion Mela Women's Geometric Print Casual Shirt,Slim,Clothing,Women's Clothing
Kasturi Women's Solid Casual Shirt,Slim,Clothing,Women's Clothing
F&S Women's Checkered Casual Shirt,Regular,Clothing,Women's Clothing
Eves Pret A Porter Women's Floral Print Casual Shirt,Regular,Clothing,Women's Clothing
Tulsattva Women's Printed Casual Shirt,Slim,Clothing,Women's Clothing
Eves Pret A Porter Women's Checkered Casual Shirt,Regular,Clothing,Women's Clothing
Femella Women's Printed Party Shirt,Regular Fit,Clothing,Women's Clothing
Iknow Women's Solid Party Shirt,Slim,Clothing,Women's Clothing
Seeyaar Women's Solid Casual Shirt,Regular,Clothing,Women's Clothing
Famous By Payal Kapoor Women's Animal Print Casual Shirt,Regular,Clothing,Women's Clothing
Leelan Women's Solid Casual Shirt,Comfortable Fit,Clothing,Women's Clothing
SS Women's Checkered Casual Shirt,Regular,Clothing,Women's Clothing
Jazzup Women's Printed Casual Shirt,Regular,Clothing,Women's Clothing
Meira Women's Solid Party Shirt,Regular Fit,Clothing,Women's Clothing
Elmo Women's Solid Casual Shirt,Regular,Clothing,Women's Clothing
Dede'S Women's Printed Casual Shirt,Regular,Clothing,Women's Clothing
MansiCollections Women's Checkered Casual Shirt,Regular,Clothing,Women's Clothing
Meira Women's Printed Party Reversible Shirt,Regular,Clothing,Women's Clothing
Anasazi Women's Paisley Casual Shirt,Regular,Clothing,Women's Clothing
Concepts Women's Printed Casual Shirt,Regular,Clothing,Women's Clothing
House Of Tantrums Women's Solid Casual Shirt,Regular,Clothing,Women's Clothing
People Women's Geometric Print Casual Shirt,Regular,Clothing,Women's Clothing
Dhrohar Women's Solid Casual Shirt,Regular,Clothing,Women's Clothing
Fille Divin Women's Printed Casual Shirt,Regular,Clothing,Women's Clothing
Fabpoppy Women's Solid Casual Shirt,Regular,Clothing,Women's Clothing
"Stop To Start by Shoppers Stop Women's Self Design Casual, Formal Shirt",Regular,Clothing,Women's Clothing
People Women's Checkered Formal Shirt,Regular,Clothing,Women's Clothing
Femella Women's Solid Casual Shirt,Regular Fit,Clothing,Women's Clothing
Aardee Women's Printed Casual Shirt,Slim,Clothing,Women's Clothing
Seeyaar Women's Striped Casual Shirt,Regular,Clothing,Women's Clothing
Gudluk Women's Solid Casual Shirt,Slim,Clothing,Women's Clothing
Shopper Tree Women's Solid Casual Shirt,Slim,Clothing,Women's Clothing
Adhaans Women's Printed Casual Shirt,Regular,Clothing,Women's Clothing
House Of Tantrums Women's Printed Casual Shirt,Regular,Clothing,Women's Clothing
Nineteen Women's Striped Casual Shirt,Regular,Clothing,Women's Clothing
Nineteen Women's Checkered Casual Shirt,Regular,Clothing,Women's Clothing
Pique Republic Women's Printed Casual Shirt,Regular,Clothing,Women's Clothing
East West Women's Solid Casual Shirt,Slim,Clothing,Women's Clothing
Oxolloxo Women's Geometric Print Casual Shirt,Regular Fit,Clothing,Women's Clothing
Colors Couture Women's Polka Print Casual Shirt,Slim Fit,Clothing,Women's Clothing
Wisstler Women's Solid Casual Shirt,Regular,Clothing,Women's Clothing
Attire By Kapsons Women's Solid Casual Shirt,Regular,Clothing,Women's Clothing
Species Women's Floral Print Casual Shirt,Regular,Clothing,Women's Clothing
Trend Arrest Women's Printed Casual Shirt,Regular,Clothing,Women's Clothing
Itrendz Women's Printed Casual Shirt,Regular fit,Clothing,Women's Clothing
Candies by Pantaloons Women's Solid Casual Shirt,Regular,Clothing,Women's Clothing
Hermosear Women's Paisley Formal Shirt,Slim,Clothing,Women's Clothing
Aardee Women's Solid Casual Shirt,Slim,Clothing,Women's Clothing
Gudluk Women's Checkered Casual Shirt,Slim,Clothing,Women's Clothing
Blute Women's Striped Casual Shirt,Slim,Clothing,Women's Clothing
Silly People Women's Printed Casual Shirt,Regular,Clothing,Women's Clothing
Concepts Women's Embroidered Casual Denim Shirt,Regular,Clothing,Women's Clothing
India Inc Women's Striped Casual Shirt,Regular,Clothing,Women's Clothing
Attire By Kapsons Women's Printed Casual Shirt,Regular,Clothing,Women's Clothing
Jazzup Women's Checkered Casual Shirt,Regular,Clothing,Women's Clothing
Bonhomie Women's Printed Casual Shirt,Regular,Clothing,Women's Clothing
Silly People Women's Striped Casual Shirt,Regular,Clothing,Women's Clothing
Aussehen Women's Printed Casual Shirt,Regular Fit,Clothing,Women's Clothing
Anouk Women's Printed Casual Shirt,Regular Fit,Clothing,Women's Clothing
Mallory Winston Women's Checkered Casual Shirt,Slim,Clothing,Women's Clothing
Belly Bottom Women's Printed Party Shirt,Slim,Clothing,Women's Clothing
"Modimania Women's Self Design Casual, Formal, Festive, Party Shirt",Slim,Clothing,Women's Clothing
ShopperTree Women's Solid Casual Shirt,Slim,Clothing,Women's Clothing
Lol Women's Solid Casual Shirt,Slim,Clothing,Women's Clothing
Hsfs Women's Printed Casual Shirt,Regular,Clothing,Women's Clothing
DeDe'S Women's Printed Casual Shirt,Regular,Clothing,Women's Clothing
Ausy Women's Solid Casual Shirt,Slim,Clothing,Women's Clothing
Tokyo Talkies Women's Self Design Casual Shirt,Regular,Clothing,Women's Clothing
Roadster Women's Solid Casual Shirt,Regular,Clothing,Women's Clothing
Tokyo Talkies Women's Floral Print Casual Shirt,Regular,Clothing,Women's Clothing
Numero Uno Women's Solid Casual Shirt,Regular Fit,Clothing,Women's Clothing
Cambow Women's Solid Casual Shirt,Regular,Clothing,Women's Clothing
Bedazzle Women's Solid Casual Shirt,Regular,Clothing,Women's Clothing
Bombay High Women's Checkered Formal Shirt,Slim,Clothing,Women's Clothing
Globus Women's Printed Casual Shirt,Regular,Clothing,Women's Clothing
"Osumfab Women's Solid Casual, Formal Shirt",Regular,Clothing,Women's Clothing
"STOP by Shoppers Stop Women's Solid Casual, Formal Shirt",Regular,Clothing,Women's Clothing
"Addyvero Women's Solid Casual, Formal Denim Shirt",Slim,Clothing,Women's Clothing
Asmara Women's Floral Print Casual Shirt,Regular,Clothing,Women's Clothing
Kashana Fashions Women's Solid Casual Shirt,Regular fit,Clothing,Women's Clothing
Fabpoppy Women's Floral Print Casual Shirt,Regular,Clothing,Women's Clothing
Ethnicbazaar Women's Printed Casual Shirt,Slim,Clothing,Women's Clothing
Entease Women's Floral Print Casual Shirt,Regular,Clothing,Women's Clothing
Moh Maya Women's Polka Print Casual Shirt,Slim,Clothing,Women's Clothing
Eyelet Women's Printed Casual Shirt,Slim,Clothing,Women's Clothing
Tokyo Talkies Women's Striped Casual Shirt,Regular,Clothing,Women's Clothing
Dumdaar.Com Women's Self Design Casual Shirt,Regular,Clothing,Women's Clothing
Kiosha Women's Checkered Casual Shirt,Slim,Clothing,Women's Clothing
ONLY Women's Printed Casual Shirt,Regular,Clothing,Women's Clothing
"khodal fashion Embroidered Women's Lehenga, Choli and Dupatta Set",khodal fashion,Clothing,Women's Clothing
"fashion rudraksh Embroidered Women's Lehenga, Choli and Dupatta Set",fashion rudraksh,Clothing,Women's Clothing
GALLOWAY skinny Fit Women's Jeans,GALLOWAY,Clothing,Women's Clothing
StyloFashionGarments slim Fit Women's Jeans,StyloFashionGarments,Clothing,Women's Clothing
TARAMA Skinny Fit Fit Women's Jeans,TARAMA,Clothing,Women's Clothing
1OAK Women's Floral Print Casual Shirt,1OAK,Clothing,Women's Clothing
Pavvoin Lingerie Set,Pavvoin,Clothing,Women's Clothing
1OAK Women's Polka Print Casual Shirt,1OAK,Clothing,Women's Clothing
Goddess Women Women's Animal Print Casual Shirt,Slim,Clothing,Women's Clothing
Mask Lifestyle Women's Animal Print Casual Shirt,Slim,Clothing,Women's Clothing
Trend18 Women's Animal Print Casual Shirt,Regular,Clothing,Women's Clothing
Love From India Women's Printed Casual Shirt,Regular,Clothing,Women's Clothing
The Beach Company Women's Animal Print Casual Shirt,Slim,Clothing,Women's Clothing
"Goddess Women Women's Solid, Self Design Casual Shirt",Slim,Clothing,Women's Clothing
Roadster Women's Checkered Casual Shirt,Slim Fit,Clothing,Women's Clothing
Eavan Women's Self Design Casual Shirt,Slim,Clothing,Women's Clothing
Roadster Women's Checkered Casual Reversible Shirt,Slim Fit,Clothing,Women's Clothing
StylElite Women's Printed Casual Shirt,Regular,Clothing,Women's Clothing
Love From India Women's Geometric Print Casual Shirt,Slim,Clothing,Women's Clothing
Kamakshi Krafts Printed Women's Jumpsuit,Kamakshi Krafts,Clothing,Women's Clothing
"LGC Women's Black, Maroon Capri",LGC,Clothing,Women's Clothing
"Shonaya Georgette, Crepe Embroidered Semi-stitched Gown",Shonaya,Clothing,Women's Clothing
k shopping Cotton Printed Salwar Suit Dupatta Material,k shopping,Clothing,Women's Clothing
Fashion Forever Georgette Embroidered Multi-purpose Fabric,Fashion Forever,Clothing,Women's Clothing
"JDK NOVELTY Brocade, Art Silk, Organza Floral Print Multi-purpose Fabric, Kurti Fabric, Blouse Material, Kurta Fabric, Dress/Top Material, Jacket Fabric, Kurta & Pallazo Material, Sherwani Fabric, Kurta & Churidar Material, Lace, Salwar Suit Material, Kurta & Patiyala Material, Lehenga Choli Material",JDK NOVELTY,Clothing,Women's Clothing
"JDK NOVELTY Brocade, Art Silk, Organza Self Design Multi-purpose Fabric, Kurti Fabric, Blouse Material, Kurta Fabric, Dress/Top Material, Jacket Fabric, Kurta & Pallazo Material, Sherwani Fabric, Kurta & Churidar Material, Lace, Salwar Suit Material, Kurta & Patiyala Material, Lehenga Choli Material",JDK NOVELTY,Clothing,Women's Clothing
"JDK NOVELTY Brocade, Art Silk, Organza Floral Print Multi-purpose Fabric, Kurti Fabric, Blouse Material, Kurta Fabric, Dress/Top Material, Jacket Fabric, Lehenga Choli Material, Kurta & Patiyala Material, Salwar Suit Material, Lace, Kurta & Churidar Material, Sherwani Fabric, Kurta & Pallazo Material",JDK NOVELTY,Clothing,Women's Clothing
"JDK NOVELTY Brocade, Art Silk, Organza Floral Print Multi-purpose Fabric, Kurta & Pallazo Material, Kurti Fabric, Lace, Salwar Suit Material, Jacket Fabric, Kurta Fabric, Lehenga Choli Material, Blouse Material, Kurta & Churidar Material, Kurta & Patiyala Material, Dress/Top Material, Sherwani Fabric",JDK NOVELTY,Clothing,Women's Clothing
"JDK NOVELTY Brocade, Art Silk, Organza Floral Print Multi-purpose Fabric, Kurti Fabric, Blouse Material, Dress/Top Material, Jacket Fabric, Salwar Suit Material, Kurta & Pallazo Material, Lehenga Choli Material, Lace, Kurta Fabric, Kurta & Patiyala Material, Kurta & Churidar Material, Sherwani Fabric",JDK NOVELTY,Clothing,Women's Clothing
Shayona Net Embroidered Multi-purpose Fabric,Shayona,Clothing,Women's Clothing
Morph Maternity Women's A-line Blue Dress,Morph Maternity,Clothing,Women's Clothing
RANGSUTRA Embroidered Women's A-line Kurta,RANGSUTRA,Clothing,Women's Clothing
Gulmohar Jaipur Embroidered Women's Straight Kurta,Gulmohar Jaipur,Clothing,Women's Clothing
Cotton Fab Printed Women's Maternity Wear Kurti,Cotton Fab,Clothing,Women's Clothing
Baalaa Printed Women's Straight Kurta,Baalaa,Clothing,Women's Clothing
Shwetna.com Checkered Women's Straight Kurta,Shwetna.com,Clothing,Women's Clothing
Baalaa Striped Women's Straight Kurta,Baalaa,Clothing,Women's Clothing
Port Party Embroidered Women's Maternity Wear Kurti,Port,Clothing,Women's Clothing
AaliyaB Embellished Women's Flared Kurta,AaliyaB,Clothing,Women's Clothing
Baalaa Solid Women's Flared Kurta,Baalaa,Clothing,Women's Clothing
Gulmohar Jaipur Printed Women's Straight Kurta,Gulmohar Jaipur,Clothing,Women's Clothing
"CHIKFAB Regular Fit Women's Blue, Black, Pink, Pink, White Trousers",CHIKFAB,Clothing,Women's Clothing
Alobha Regular Fit Women's White Trousers,Alobha,Clothing,Women's Clothing
Meera Regular Fit Women's Black Trousers,Meera,Clothing,Women's Clothing
Shwetna.com Embroidered Women's Straight Kurta,Shwetna.com,Clothing,Women's Clothing
Cotton Fab Solid Women's Maternity Wear Kurti,Cotton Fab,Clothing,Women's Clothing
Abhinl Fashion Cotton Printed Semi-stitched Salwar Suit Dupatta Material,Abhinl Fashion,Clothing,Women's Clothing
"Glitterss Women's White, Beige, Blue Jeggings",Glitterss,Clothing,Women's Clothing
VIHA Cotton Embroidered Semi-stitched Salwar Suit Dupatta Material,VIHA,Clothing,Women's Clothing
aahnafashion Crepe Printed Kurti Fabric,aahnafashion,Clothing,Women's Clothing
mae Women's Hipster Panty,mae,Clothing,Women's Clothing
"New tastemaker Women's Black, Blue, Red Leggings",New tastemaker,Clothing,Women's Clothing
UR Image by Ur Image - Fashion Women's Full Coverage Bra,UR Image,Clothing,Women's Clothing
Simrit Women's Pyjama,Simrit,Clothing,Women's Clothing
ATHENA Women's Wrap Dress,ATHENA,Clothing,Women's Clothing
Miss Clyra Women's Brief Panty,Miss Clyra,Clothing,Women's Clothing
Selfcare Women's Thong Panty,Selfcare,Clothing,Women's Clothing
SUNWIN Women's Pyjama,SUNWIN,Clothing,Women's Clothing
Amante Women's Boy Short Panty,Amante,Clothing,Women's Clothing
Nite Flite Women's Pyjama,Nite Flite,Clothing,Women's Clothing
ATHENA Women's Maxi Dress,ATHENA,Clothing,Women's Clothing
Vero Moda Women's Maxi Dress,Vero Moda,Clothing,Women's Clothing
EthnicQueen Women's A-line Dress,EthnicQueen,Clothing,Women's Clothing
Rosaline by Zivame - Pro Women's Full Coverage Bra,Rosaline,Clothing,Women's Clothing
Coucou by Zivame - Pro Women's T-Shirt Bra,Coucou,Clothing,Women's Clothing
Amante Women's Thong Panty,Amante,Clothing,Women's Clothing
Vero Moda Women's Shift Dress,Vero Moda,Clothing,Women's Clothing
Triumph Women's T-Shirt Bra,Triumph,Clothing,Women's Clothing
AHAANA FASHION Women's Shift Dress,AHAANA FASHION,Clothing,Women's Clothing
Prym Women's A-line Dress,Prym,Clothing,Women's Clothing
Miss Clyra Women's Full Coverage Bra,Miss Clyra,Clothing,Women's Clothing
"Knot in Love by Disha Chadha - Sunset Orange Hand Crocheted Bikini Top Women's Plunge, Bralette Bra",Knot in Love,Clothing,Women's Clothing
Zeroed Women's Fit and Flare Dress,Zeroed,Clothing,Women's Clothing
"Tipsy Set of 3 Tube Bra in Red, White and Black colours Women's Tube Bra",Tipsy,Clothing,Women's Clothing
Mee Mee Baby Girl's Textured Stockings,Mee Mee,Clothing,Women's Clothing
"AirFlow Women's, Girl's Regular Stockings",AirFlow,Clothing,Women's Clothing
LIME Women's Full Coverage Bra,LIME,Clothing,Women's Clothing
SHIMZA by SHIMZA - Women's Bra Women's Full Coverage Bra,SHIMZA,Clothing,Women's Clothing
DIVAS CHOICE Animal Print polyester Women's Stole,DIVAS CHOICE,Clothing,Women's Clothing
skhoza Self Design chiffon Women's Scarf,skhoza,Clothing,Women's Clothing
Platinum Square Neck Women's Blouse,Platinum,Clothing,Women's Clothing
Nimfill Women's Camisole,Nimfill,Clothing,Women's Clothing
Clovia Clovia Cotton Lycra Nursing Bra In Pink With Embroidered Lace Women's Maternity Bra,Clovia,Clothing,Women's Clothing
NumBrave Casual 3/4 Sleeve Solid Women's Pink Top,NumBrave,Clothing,Women's Clothing
SAJAY FASHIONS Geometric Print COTTON Women's Stole,SAJAY FASHIONS,Clothing,Women's Clothing
DIVAS CHOICE Graphic Print polyester Women's Stole,DIVAS CHOICE,Clothing,Women's Clothing
"Weavers Villa Printed Set of 3 Scarves, Stoles, Dupattas Small Soft Summer Vibrant Coloured Trendy Women's Scarf",Weavers Villa,Clothing,Women's Clothing
BOTH11 Skinny Fit Women's Blue Jeans,BOTH11,Clothing,Women's Clothing
Hyipe Women's Geometric Print Casual Shirt,Regular,Clothing,Women's Clothing
carrol Women's Shrug,carrol,Clothing,Women's Clothing
Urbanvillage Cotton Self Design Women's Dupatta,Urbanvillage,Clothing,Women's Clothing
Yepme Full Sleeve Solid Women's Sweatshirt,Yepme,Clothing,Women's Clothing
Roadster Half Sleeve Solid Women's Sweatshirt,Roadster,Clothing,Women's Clothing
Ira Soleil Solid Women's Tunic,Ira Soleil,Clothing,Women's Clothing
Simrit Women's Nighty,Simrit,Clothing,Women's Clothing
stylishvilla Embroidered Kurta & Patiyala,stylishvilla,Clothing,Women's Clothing
stylishvilla Embroidered Kurta & Churidar,stylishvilla,Clothing,Women's Clothing
Khushi Fashions Printed Kurta & Pallazo,Khushi Fashions,Clothing,Women's Clothing
LIENZ Women's Camisole,LIENZ,Clothing,Women's Clothing
Krasiv Women's Camisole,Krasiv,Clothing,Women's Clothing
Bottoms More Slim Fit Women's Trousers,Bottoms More,Clothing,Women's Clothing
Pezzava Regular Fit Women's Trousers,Pezzava,Clothing,Women's Clothing
United Colors of Benetton Slim Fit Women's Trousers,United Colors of Benetton,Clothing,Women's Clothing
W Regular Fit Women's Trousers,W,Clothing,Women's Clothing
feminine Regular Fit Women's Trousers,feminine,Clothing,Women's Clothing
"Scholar Girl's, Women's Camisole",Scholar,Clothing,Women's Clothing
GO LUCKNOW Embroidered Women's Straight Kurta,GO LUCKNOW,Clothing,Women's Clothing
Gudi Full Sleeve Striped Women's Jacket,Gudi,Clothing,Women's Clothing
Change360 Full Sleeve Solid Women's Jacket,Change360,Clothing,Women's Clothing
NEXASHOP Solid Women's Boxer,NEXASHOP,Clothing,Women's Clothing
Shree Creation Net Embroidered Semi-stitched Gown,Shree Creation,Clothing,Women's Clothing
Neon Georgette Embroidered Multi-purpose Fabric,Neon,Clothing,Women's Clothing
Neon Cotton Embroidered Multi-purpose Fabric,Neon,Clothing,Women's Clothing
Jaipurkurti Striped Women's Straight Kurta,Jaipurkurti,Clothing,Women's Clothing
"Aarti Collections Women's Self Design Casual, Formal Denim Light Blue Shirt",Aarti Collections,Clothing,Women's Clothing
C9 Women's Sports Bra,C9,Clothing,Women's Clothing
Novel Sporty Women's Sports Bra,Novel,Clothing,Women's Clothing
Satrani Cotton Embroidered Salwar Suit Dupatta Material,Satrani,Clothing,Women's Clothing
Berge Women's Track Top,Berge,Clothing,Women's Clothing
Texco Women's Track Top,Texco,Clothing,Women's Clothing
Liz Lange Printed Women's Round Neck Orange T-Shirt,Liz Lange,Clothing,Women's Clothing
Shoprillo Women's Solid Formal Shirt,Shoprillo,Clothing,Women's Clothing
Speedo Endurance10+Raceback Solid Women's,Speedo,Clothing,Women's Clothing
SHOP FRENZY Women's Pyjama,SHOP FRENZY,Clothing,Women's Clothing
Creez Printed Women's Abstract Fractal Print Capri Tights,Creez,Clothing,Women's Clothing
Lady Stark Women's Maxi Multicolor Dress,Lady Stark,Clothing,Women's Clothing
MomToBe Women's A-line Green Dress,MomToBe,Clothing,Women's Clothing
Khwaab Enterprise Solid Fashion Chiffon Sari,Khwaab Enterprise,Clothing,Women's Clothing
"Khwaab Enterprise Self Design Fashion Chiffon, Satin Sari",Khwaab Enterprise,Clothing,Women's Clothing
ZALULA Women's Shrug,ZALULA,Clothing,Women's Clothing
Mast & Harbour Skinny Fit Women's Jeans,Mast & Harbour,Clothing,Women's Clothing
NIROSHA Women's Nighty,NIROSHA,Clothing,Women's Clothing
Orange and Orchid Women's Shrug,Orange and Orchid,Clothing,Women's Clothing
PURYS Women's Shrug,PURYS,Clothing,Women's Clothing
SKIDLERS Women's Shrug,SKIDLERS,Clothing,Women's Clothing
KAPFAB Printed Daily Wear Art Silk Sari,KAPFAB,Clothing,Women's Clothing
jay fashion Floral Print Bollywood Georgette Sari,jay fashion,Clothing,Women's Clothing
Fashiondeal Printed Daily Wear Cotton Sari,Fashiondeal,Clothing,Women's Clothing
kush creation Cotton Embroidered Semi-stitched Salwar Suit Dupatta Material,kush creation,Clothing,Women's Clothing
NEWLOOK Net Embroidered Semi-stitched Salwar Suit Dupatta Material,NEWLOOK,Clothing,Women's Clothing
Awesome Fab Georgette Embroidered Semi-stitched Salwar Suit Dupatta Material,Awesome Fab,Clothing,Women's Clothing
NEWLOOK Georgette Embroidered Semi-stitched Salwar Suit Dupatta Material,NEWLOOK,Clothing,Women's Clothing
Gopalvilla Georgette Embroidered Semi-stitched Salwar Suit Dupatta Material,Gopalvilla,Clothing,Women's Clothing
Man2 OSH Kimaka Men's Shapewear,Man2 OSH Kimaka,Clothing,Women's Clothing
texclusive Silk Embroidered Semi-stitched Salwar Suit Dupatta Material,texclusive,Clothing,Women's Clothing
Wetex Premium Women's Shapewear,Wetex Premium,Clothing,Women's Clothing
Wonder World Women's Shapewear,Wonder World,Clothing,Women's Clothing
"Viyasha Women's, Girl's Shapewear",Viyasha,Clothing,Women's Clothing
Sizzlacious Women's Shapewear,Sizzlacious,Clothing,Women's Clothing
GOLDEN GIRL Women's Shapewear,GOLDEN GIRL,Clothing,Women's Clothing
Da intimo Women's Shapewear,Da intimo,Clothing,Women's Clothing
Simran Synthetic Floral Print Salwar Suit Material,Simran,Clothing,Women's Clothing
"Styleworld Chanderi, Cotton Embroidered Semi-stitched Salwar Suit Dupatta Material",Styleworld,Clothing,Women's Clothing
Fabcart Chanderi Embroidered Semi-stitched Salwar Suit Material,Fabcart,Clothing,Women's Clothing
Inddus Party Printed Women's Kurti,Inddus,Clothing,Women's Clothing
Lajo Women's Salwar and Dupatta Set,Lajo,Clothing,Women's Clothing
"KA Women's Kurta, Pyjama & Dupatta Set",KA,Clothing,Women's Clothing
RONAKSILK Women's Churidar and Dupatta Set,RONAKSILK,Clothing,Women's Clothing
"Lajo Women's Kurta, Pyjama & Dupatta Set",Lajo,Clothing,Women's Clothing
Shreeka Women's Patiala and Dupatta Set,Shreeka,Clothing,Women's Clothing
Sitaram Women's Top and Skirt Set,Sitaram,Clothing,Women's Clothing
"Cynthia's Fashion Women's, Girl's Kurta, Pyjama & Dupatta Set",Cynthia's Fashion,Clothing,Women's Clothing
Atithee Women's Top and Skirt Set,Atithee,Clothing,Women's Clothing
Lajo Women's Salwar and Kurta Set,Lajo,Clothing,Women's Clothing
Ninecolours Women's Churidar and Dupatta Set,Ninecolours,Clothing,Women's Clothing
SAJNA CELEBRATIONS Women's Nighty,SAJNA CELEBRATIONS,Clothing,Women's Clothing
DEEPAK N DIVYA Women's Kurta and Pyjama Set,DEEPAK N DIVYA,Clothing,Women's Clothing
Indiatrendzs Embellished Women's A-line Yellow Skirt,Indiatrendzs,Clothing,Women's Clothing
"Pezzava Self Design Women's, Girl's Regular Blue Skirt",Pezzava,Clothing,Women's Clothing
Shopmore Printed Women's Regular Pink Skirt,Shopmore,Clothing,Women's Clothing
"Antistreet Printed, Self Design, Solid Women's Regular Black Skirt",Antistreet,Clothing,Women's Clothing
KAROZ Full Sleeve Solid Women's Sweatshirt,KAROZ,Clothing,Women's Clothing
Sinina Chanderi Embroidered Salwar Suit Dupatta Material,Sinina,Clothing,Women's Clothing
Aarushi Fashion Chanderi Embroidered Salwar Suit Dupatta Material,Aarushi Fashion,Clothing,Women's Clothing
"Ambika Lahenga Embroidered Lehenga, Choli and Dupatta Set",Ambika Lahenga,Clothing,Women's Clothing
Aarushi Fashion Silk Striped Salwar Suit Dupatta Material,Aarushi Fashion,Clothing,Women's Clothing
dongli Printed Boy's Round Neck T-Shirt,dongli,Clothing,Kid's Clothing
Oye Boy's Dungaree,Oye,Clothing,Kid's Clothing
Masaba for Magic fairy Girl's Layered Pink Dress,Masaba for Magic fairy,Clothing,Kid's Clothing
Mothercare Leggings,Mothercare,Clothing,Kid's Clothing
Kitts N Nevis Slim Fit Girl's Jeans,Kitts N Nevis,Clothing,Kid's Clothing
