name,brand,category1,category2
Valtellina Abstract Double Blanket Brown,b'Valtellina',Home & Kitchen & Automotive,Home Furnishing
Valtellina Abstract Double Blanket Red,b'Valtellina',Home & Kitchen & Automotive,Home Furnishing
"Digilight 400 inch Green, Pink, Red Rice Lights",b'Digilight',Home & Kitchen & Automotive,Home Furnishing
Megaway 196.85 inch White Rice Lights,b'Megaway',Home & Kitchen & Automotive,Home Furnishing
Gift Studios Buddha Stone Showpiece  -  17.6 cm,b'Gift Studios',Home & Kitchen & Automotive,Home Furnishing
COLORS FOR LIVING Plain Throw Orange,b'COLORS FOR LIVING',Home & Kitchen & Automotive,Home Furnishing
Aurraa Printed Single Quilts & Comforters Green,b'Aurraa',Home & Kitchen & Automotive,Home Furnishing
Craft Store India Buddha head Showpiece  -  20 cm,b'Craft Store India',Home & Kitchen & Automotive,Home Furnishing
Kiya Trends 6 inch Pink Rice Lights,b'Kiya Trends',Home & Kitchen & Automotive,Home Furnishing
The Intellect Bazaar Floral Double Blanket Grey,b'The Intellect Bazaar',Home & Kitchen & Automotive,Home Furnishing
Nagar Handloom Floral Double Blanket Multi,b'Nagar Handloom',Home & Kitchen & Automotive,Home Furnishing
Digilight 400 inch Green Rice Lights,b'Digilight',Home & Kitchen & Automotive,Home Furnishing
"Digilight 200 inch White, Green, Blue Rice Lights",b'Digilight',Home & Kitchen & Automotive,Home Furnishing
Paisa worth Plain Single Electric Blanket Multicolour,b'Paisa worth',Home & Kitchen & Automotive,Home Furnishing
Indcrown 816 inch Multicolor Rice Lights,b'Indcrown',Home & Kitchen & Automotive,Home Furnishing
Spangle Floral Single Quilts & Comforters PINK,b'Spangle',Home & Kitchen & Automotive,Home Furnishing
"Digilight 200 inch Pink, Green, Yellow Rice Lights",b'Digilight',Home & Kitchen & Automotive,Home Furnishing
My Party Suppliers 720 inch Multicolor Rice Lights,b'My Party Suppliers',Home & Kitchen & Automotive,Home Furnishing
Unnati Floral Single Top Sheet Multicolor,b'Unnati',Home & Kitchen & Automotive,Home Furnishing
GrandShop 444 inch Multicolor Rice Lights,b'GrandShop',Home & Kitchen & Automotive,Home Furnishing
eCraftIndia Lord Ganesha on Elephant Showpiece  -  13.97 cm,b'eCraftIndia',Home & Kitchen & Automotive,Home Furnishing
MDI 394 inch Multicolor Rice Lights,b'MDI',Home & Kitchen & Automotive,Home Furnishing
"Digilight 590 inch Yellow, Green, Pink Rice Lights",b'Digilight',Home & Kitchen & Automotive,Home Furnishing
YNA Plain Double Blanket Brown,b'YNA',Home & Kitchen & Automotive,Home Furnishing
Welhouse Geometric Double Blanket Grey,b'Welhouse',Home & Kitchen & Automotive,Home Furnishing
Gift Studios Laxmi Ganesh Ji Stone Showpiece  -  17.6 cm,b'Gift Studios',Home & Kitchen & Automotive,Home Furnishing
Digilight 200 inch Blue Rice Lights,b'Digilight',Home & Kitchen & Automotive,Home Furnishing
Loomkart Checkered Single Blanket Multicolor Tartan,b'Loomkart',Home & Kitchen & Automotive,Home Furnishing
Sophies Shisha Assorted Hookah Flavor,b'Sophies',Home & Kitchen & Automotive,Home Furnishing
VRCT 196 inch Green Rice Lights,b'VRCT',Home & Kitchen & Automotive,Home Furnishing
Paradise Plain Single Electric Blanket Green,b'Paradise',Home & Kitchen & Automotive,Home Furnishing
The Intellect Bazaar Geometric Single Blanket Gold,b'The Intellect Bazaar',Home & Kitchen & Automotive,Home Furnishing
ShopSince Plain Single Electric Blanket Multicolour,b'ShopSince',Home & Kitchen & Automotive,Home Furnishing
My Party Suppliers 108 inch Multicolor Rice Lights,b'My Party Suppliers',Home & Kitchen & Automotive,Home Furnishing
Unnati Floral Double Top Sheet Multicolor,b'Unnati',Home & Kitchen & Automotive,Home Furnishing
Digilight 400 inch Green Rice Lights,b'Digilight',Home & Kitchen & Automotive,Home Furnishing
Home Fashion Gallery Floral Double Blanket Multicolor,b'Home Fashion Gallery',Home & Kitchen & Automotive,Home Furnishing
Metro 300 inch White Rice Lights,b'Metro',Home & Kitchen & Automotive,Home Furnishing
"Digilight 200 inch Blue, White, Yellow Rice Lights",b'Digilight',Home & Kitchen & Automotive,Home Furnishing
"Home Delight 10 inch Red, Green, Blue, Multicolor Rice Lights",b'Home Delight',Home & Kitchen & Automotive,Home Furnishing
Majestic Floral King Blanket Multicolour,b'Majestic',Home & Kitchen & Automotive,Home Furnishing
Adaa Buddha In Aashirwad Mudra Showpiece  -  9 cm,b'Adaa',Home & Kitchen & Automotive,Home Furnishing
The Art Box Floral Single Dohar Multicolor,b'The Art Box',Home & Kitchen & Automotive,Home Furnishing
Urban Style Abstract Double Quilts & Comforters Multicolor,b'Urban Style',Home & Kitchen & Automotive,Home Furnishing
"Digilight 200 inch Green, White, Red Rice Lights",b'Digilight',Home & Kitchen & Automotive,Home Furnishing
ShopSince Plain Single Electric Blanket Multicolour,b'ShopSince',Home & Kitchen & Automotive,Home Furnishing
Valtellina Abstract Double Blanket Grey,b'Valtellina',Home & Kitchen & Automotive,Home Furnishing
"Digilight 200 inch White, Blue, Yellow Rice Lights",b'Digilight',Home & Kitchen & Automotive,Home Furnishing
Amazing India God Goddess Radha Krishna Statue Idol Showpiece  -  20.3 cm,b'Amazing India',Home & Kitchen & Automotive,Home Furnishing
"Al Fakher Pegs'N'Pipes Mint, Double Apple Hookah Flavor",b'Al Fakher',Home & Kitchen & Automotive,Home Furnishing
Weldecor 1800 inch Red Rice Lights,b'Weldecor',Home & Kitchen & Automotive,Home Furnishing
Golmaalshop Ganesh & Laxmi Showpiece  -  14.7 cm,b'Golmaalshop',Home & Kitchen & Automotive,Home Furnishing
Unnati Floral Double Blanket Multicolor,b'Unnati',Home & Kitchen & Automotive,Home Furnishing
Majestic Floral King Blanket Multicolour,b'Majestic',Home & Kitchen & Automotive,Home Furnishing
"Digilight 590 inch Pink, Blue, Green Rice Lights",b'Digilight',Home & Kitchen & Automotive,Home Furnishing
"Digilight 200 inch Red, Blue, Green Rice Lights",b'Digilight',Home & Kitchen & Automotive,Home Furnishing
"Indcrown 672 inch Red, Green, Yellow, Blue Rice Lights",b'Indcrown',Home & Kitchen & Automotive,Home Furnishing
"Digilight 400 inch Red, Blue, Green Rice Lights",b'Digilight',Home & Kitchen & Automotive,Home Furnishing
Eshoppee Shiv face antique color brass idol Showpiece  -  8 cm,b'Eshoppee',Home & Kitchen & Automotive,Home Furnishing
Toygully 589 inch Multicolor Rice Lights,b'Toygully',Home & Kitchen & Automotive,Home Furnishing
Cloth Fusion Printed Single Blanket Orange,b'Cloth Fusion',Home & Kitchen & Automotive,Home Furnishing
"Digilight 200 inch Yellow, Pink, Purple Rice Lights",b'Digilight',Home & Kitchen & Automotive,Home Furnishing
Zesture Cartoon Double Blanket Multicolor,b'Zesture',Home & Kitchen & Automotive,Home Furnishing
Art Antiqua AA-1203091-Reading Ganesha Showpiece  -  9 cm,b'Art Antiqua',Home & Kitchen & Automotive,Home Furnishing
England Checkered Double Blanket Multi Color,b'England',Home & Kitchen & Automotive,Home Furnishing
"iplay 196 inch Red, Green, Blue, White, Gold, Yellow Rice Lights",b'iplay',Home & Kitchen & Automotive,Home Furnishing
Mee Mee Cartoon Single Hooded Baby Blanket Cream,b'Mee Mee',Home & Kitchen & Automotive,Home Furnishing
"iplay 196 inch Red, Green, Blue, White, Gold, Yellow Rice Lights",b'iplay',Home & Kitchen & Automotive,Home Furnishing
A To Z Traders 200 inch Yellow Rice Lights,b'A To Z Traders',Home & Kitchen & Automotive,Home Furnishing
Arabian Nights Soex Cranberry Assorted Hookah Flavor,b'Arabian Nights',Home & Kitchen & Automotive,Home Furnishing
Metro 300 inch Multicolor Rice Lights,b'Metro',Home & Kitchen & Automotive,Home Furnishing
Browse House Folded Hands Bank Monk Showpiece  -  11.4 cm,b'Browse House',Home & Kitchen & Automotive,Home Furnishing
Raymond Home Floral Single Quilts & Comforters Red,b'Raymond Home',Home & Kitchen & Automotive,Home Furnishing
"Digilight 200 inch Blue, White Rice Lights",b'Digilight',Home & Kitchen & Automotive,Home Furnishing
Rays007 Cartoon Double Quilts & Comforters Multicolor,b'Rays007',Home & Kitchen & Automotive,Home Furnishing
Valtellina Checkered Double Blanket Grey,b'Valtellina',Home & Kitchen & Automotive,Home Furnishing
Welhouse Geometric Double Blanket Black,b'Welhouse',Home & Kitchen & Automotive,Home Furnishing
Indcrown 15 inch Multicolor Rice Lights,b'Indcrown',Home & Kitchen & Automotive,Home Furnishing
eCraftIndia Floral Single Quilts & Comforters Multicolor,b'eCraftIndia',Home & Kitchen & Automotive,Home Furnishing
The Art Treasure Decorative Shankh,b'The Art Treasure',Home & Kitchen & Automotive,Home Furnishing
ShopSince Plain Single Electric Blanket Blue,b'ShopSince',Home & Kitchen & Automotive,Home Furnishing
ShopSince Plain Single Electric Blanket Multicolour,b'ShopSince',Home & Kitchen & Automotive,Home Furnishing
Adaa Ganesha Wall Hanging (3 Piece-Round) - Green Showpiece  -  25.5 cm,b'Adaa',Home & Kitchen & Automotive,Home Furnishing
"Digilight 590 inch White, Yellow, Red Rice Lights",b'Digilight',Home & Kitchen & Automotive,Home Furnishing
MDI 787 inch Multicolor Rice Lights,b'MDI',Home & Kitchen & Automotive,Home Furnishing
Advitiya Black Metal Gurunanak Ji Showpiece  -  28 cm,b'Advitiya',Home & Kitchen & Automotive,Home Furnishing
Jaipar Heritage Floral Single Quilts & Comforters Multicolor,b'Jaipar Heritage',Home & Kitchen & Automotive,Home Furnishing
Unnati Abstract Single Top Sheet Multicolor,b'Unnati',Home & Kitchen & Automotive,Home Furnishing
Craft And Curtain Multicolor 178 cm Table Runner,b'Craft And Curtain',Home & Kitchen & Automotive,Home Furnishing
Abee 36 inch Multicolor Rice Lights,b'Abee',Home & Kitchen & Automotive,Home Furnishing
The Intellect Bazaar Plain King Blanket Grey,b'The Intellect Bazaar',Home & Kitchen & Automotive,Home Furnishing
Apkamart Radha Krishna Wall Hanging 15 Inch Showpiece  -  37 cm,b'Apkamart',Home & Kitchen & Automotive,Home Furnishing
Gathbandhan Decorative Shankh,b'Gathbandhan',Home & Kitchen & Automotive,Home Furnishing
Unnati Abstract Single Top Sheet Multicolor,b'Unnati',Home & Kitchen & Automotive,Home Furnishing
"Digilight 400 inch Red, Yellow Rice Lights",b'Digilight',Home & Kitchen & Automotive,Home Furnishing
Veensh HARB Grinder Diameter 2.25 inch Plastic Hookah,b'Veensh',Home & Kitchen & Automotive,Home Furnishing
Veensh Red HARB Grinder Diameter 2.25 inch Plastic Hookah,b'Veensh',Home & Kitchen & Automotive,Home Furnishing
Sugandh Vatika Oudh Incense Sticks,b'Sugandh Vatika',Home & Kitchen & Automotive,Home Furnishing
LRIPL ALL DIGITAL CABLE STB Remote Controller,b'LRIPL',Home & Kitchen & Automotive,Home Furnishing
Katwa Clasic Floral 2 Seater Table Cover,b'Katwa Clasic',Home & Kitchen & Automotive,Home Furnishing
Onlinemart 2015-2016 Compatible for Toshiba AC 126 Remote Controller,b'Onlinemart',Home & Kitchen & Automotive,Home Furnishing
LRIPL DIGICABLE STB Remote Controller,b'LRIPL',Home & Kitchen & Automotive,Home Furnishing
Katwa Clasic Floral 6 Seater Table Cover,b'Katwa Clasic',Home & Kitchen & Automotive,Home Furnishing
Frames MDF Photo Frame,b'Frames',Home & Kitchen & Automotive,Home Furnishing
RYAN Cotton Apron Free Size,b'RYAN',Home & Kitchen & Automotive,Home Furnishing
Tappu Ki Dukaan Cotton Apron Free Size,b'Tappu Ki Dukaan',Home & Kitchen & Automotive,Home Furnishing
Tappu Ki Dukaan Cotton Apron Free Size,b'Tappu Ki Dukaan',Home & Kitchen & Automotive,Home Furnishing
Abhomedecor Cotton Abstract Double Bedsheet,b'Abhomedecor',Home & Kitchen & Automotive,Home Furnishing
Smart Wall Guru Small Adhesive Sticker Sticker,b'Smart Wall Guru',Home & Kitchen & Automotive,Home Furnishing
Smart Wall Guru Small Adhesive Sticker Sticker,b'Smart Wall Guru',Home & Kitchen & Automotive,Home Furnishing
Celebration Celeb 600 ArwaYellow 600 W Mixer Grinder,b'Celebration',Home & Kitchen & Automotive,Home Furnishing
Nutcase Multicolor Column Floor Lamp,b'Nutcase',Home & Kitchen & Automotive,Home Furnishing
Aaina Home Decor Linen Cloth Journal,b'Aaina Home Decor',Home & Kitchen & Automotive,Home Furnishing
GAGA Canvas Painting,b'GAGA',Home & Kitchen & Automotive,Home Furnishing
"M S Rugs Pink, Blue Wool Dhurrie",b'M S Rugs',Home & Kitchen & Automotive,Home Furnishing
Loomkart Multicolor Cotton Dhurrie,b'Loomkart',Home & Kitchen & Automotive,Home Furnishing
GAGA Canvas Painting,b'GAGA',Home & Kitchen & Automotive,Home Furnishing
GIMS Brown Viscose Carpet,b'GIMS',Home & Kitchen & Automotive,Home Furnishing
Cotonex Pink Cotton Kitchen Linen Set,b'Cotonex',Home & Kitchen & Automotive,Home Furnishing
GAGA Canvas Painting,b'GAGA',Home & Kitchen & Automotive,Home Furnishing
Loomkart Multicolor Cotton Dhurrie,b'Loomkart',Home & Kitchen & Automotive,Home Furnishing
DH-Discovery 20200W 2.1 Home Theatre System,b'DH-Discovery',Home & Kitchen & Automotive,Home Furnishing
GAGA Canvas Painting,b'GAGA',Home & Kitchen & Automotive,Home Furnishing
Loomkart Multicolor Cotton Dhurrie,b'Loomkart',Home & Kitchen & Automotive,Home Furnishing
"Cotonex Black, White Cotton Kitchen Linen Set",b'Cotonex',Home & Kitchen & Automotive,Home Furnishing
GAGA Canvas Painting,b'GAGA',Home & Kitchen & Automotive,Home Furnishing
FURNISHINGLAND Orange Silk Carpet,b'FURNISHINGLAND',Home & Kitchen & Automotive,Home Furnishing
GAGA Canvas Painting,b'GAGA',Home & Kitchen & Automotive,Home Furnishing
Loomkart Multicolor Cotton Dhurrie,b'Loomkart',Home & Kitchen & Automotive,Home Furnishing
Loomkart Multicolor Cotton Dhurrie,b'Loomkart',Home & Kitchen & Automotive,Home Furnishing
Cotonex Beige Cotton Kitchen Linen Set,b'Cotonex',Home & Kitchen & Automotive,Home Furnishing
Loomkart Multicolor Cotton Dhurrie,b'Loomkart',Home & Kitchen & Automotive,Home Furnishing
GAGA Canvas Painting,b'GAGA',Home & Kitchen & Automotive,Home Furnishing
Sony HT-GT1 2.1 Home Theatre System,b'Sony',Home & Kitchen & Automotive,Home Furnishing
GAGA Canvas Painting,b'GAGA',Home & Kitchen & Automotive,Home Furnishing
FURNISHINGLAND Green Silk Carpet,b'FURNISHINGLAND',Home & Kitchen & Automotive,Home Furnishing
FURNISHINGLAND Multicolor Polyester Carpet,b'FURNISHINGLAND',Home & Kitchen & Automotive,Home Furnishing
FURNISHINGLAND Black Polyester Carpet,b'FURNISHINGLAND',Home & Kitchen & Automotive,Home Furnishing
GAGA Canvas Painting,b'GAGA',Home & Kitchen & Automotive,Home Furnishing
loomkart Blue Polyester Runner,b'loomkart',Home & Kitchen & Automotive,Home Furnishing
GAGA Canvas Painting,b'GAGA',Home & Kitchen & Automotive,Home Furnishing
GAGA Canvas Painting,b'GAGA',Home & Kitchen & Automotive,Home Furnishing
"Cotonex Blue, Pink Cotton Kitchen Linen Set",b'Cotonex',Home & Kitchen & Automotive,Home Furnishing
Loomkart Multicolor Cotton Dhurrie,b'Loomkart',Home & Kitchen & Automotive,Home Furnishing
"M S Rugs Pink, Blue Wool Dhurrie",b'M S Rugs',Home & Kitchen & Automotive,Home Furnishing
Loomkart Multicolor Cotton Dhurrie,b'Loomkart',Home & Kitchen & Automotive,Home Furnishing
GAGA Canvas Painting,b'GAGA',Home & Kitchen & Automotive,Home Furnishing
"Cotonex Pink, Green Cotton Kitchen Linen Set",b'Cotonex',Home & Kitchen & Automotive,Home Furnishing
Loomkart Multicolor Cotton Dhurrie,b'Loomkart',Home & Kitchen & Automotive,Home Furnishing
Cotonex Blue Cotton Kitchen Linen Set,b'Cotonex',Home & Kitchen & Automotive,Home Furnishing
Loomkart Multicolor Cotton Dhurrie,b'Loomkart',Home & Kitchen & Automotive,Home Furnishing
GAGA Canvas Painting,b'GAGA',Home & Kitchen & Automotive,Home Furnishing
"Cotonex Grey, Red Cotton Kitchen Linen Set",b'Cotonex',Home & Kitchen & Automotive,Home Furnishing
GAGA Canvas Painting,b'GAGA',Home & Kitchen & Automotive,Home Furnishing
Loomkart Multicolor Cotton Dhurrie,b'Loomkart',Home & Kitchen & Automotive,Home Furnishing
GAGA Canvas Painting,b'GAGA',Home & Kitchen & Automotive,Home Furnishing
GAGA Canvas Painting,b'GAGA',Home & Kitchen & Automotive,Home Furnishing
FURNISHINGLAND Maroon Silk Carpet,b'FURNISHINGLAND',Home & Kitchen & Automotive,Home Furnishing
Loomkart Multicolor Cotton Dhurrie,b'Loomkart',Home & Kitchen & Automotive,Home Furnishing
FURNISHINGLAND Brown Polyester Carpet,b'FURNISHINGLAND',Home & Kitchen & Automotive,Home Furnishing
Giftwell Buddha Showpiece  -  28 cm,b'Giftwell',Home & Kitchen & Automotive,Home Furnishing
JTC Platinum Water Dispenser Cover,b'JTC Platinum',Home & Kitchen & Automotive,Home Furnishing
"AUROSHIKHA Natural Myrrh Frankincense, Gum Benzoin, Gum Copal, Gum Damar & Siam Benzoin Incense Sticks",b'AUROSHIKHA',Home & Kitchen & Automotive,Home Furnishing
Swastik Velvet Sofa Cover,b'Swastik',Home & Kitchen & Automotive,Home Furnishing
Bela Home Cotton Cartoon Single Bedsheet,b'Bela Home',Home & Kitchen & Automotive,Home Furnishing
Bela Home Cotton Cartoon Single Bedsheet,b'Bela Home',Home & Kitchen & Automotive,Home Furnishing
Swastik Cotton Sofa Cover,b'Swastik',Home & Kitchen & Automotive,Home Furnishing
Swastik Velvet Sofa Cover,b'Swastik',Home & Kitchen & Automotive,Home Furnishing
Ville Style Polyester Maroon Floral Eyelet Door Curtain,b'Ville Style',Home & Kitchen & Automotive,Home Furnishing
Arghyam PAGDI GANESH Showpiece  -  14 cm,b'Arghyam',Home & Kitchen & Automotive,Home Furnishing
ROYLE KATOCH Showpiece  -  24 cm,b'ROYLE KATOCH',Home & Kitchen & Automotive,Home Furnishing
Jaycoknit Mediterranean Sea's Lucky Wooden Handcrafted Ship Part II Showpiece  -  17 cm,b'Jaycoknit',Home & Kitchen & Automotive,Home Furnishing
Cratly 5I Vase Filler,b'Cratly',Home & Kitchen & Automotive,Home Furnishing
Cratly 7I Vase Filler,b'Cratly',Home & Kitchen & Automotive,Home Furnishing
Maharaja Timer Electric Tandoor,b'Maharaja',Home & Kitchen & Automotive,Home Furnishing
Rosepetal Cotton Floral Diwan Set,b'Rosepetal',Home & Kitchen & Automotive,Home Furnishing
Aamore Decor Tribal Man Showpiece  -  25 cm,b'Aamore Decor',Home & Kitchen & Automotive,Home Furnishing
Aakrati Brass Sculpture Metal Handicrafts Gift Showpiece  -  17.78 cm,b'Aakrati',Home & Kitchen & Automotive,Home Furnishing
Agnihotra Creations Hanger Showpiece  -  37.5 cm,b'Agnihotra Creations',Home & Kitchen & Automotive,Home Furnishing
Serebroarts Iron Decorative Platter,b'Serebroarts',Home & Kitchen & Automotive,Home Furnishing
Art Godaam Colored figure Showpiece  -  50 cm,b'Art Godaam',Home & Kitchen & Automotive,Home Furnishing
Navisha Polypropylene Decorative Platter,b'Navisha',Home & Kitchen & Automotive,Home Furnishing
Fourwalls Showpiece  -  34 cm,b'Fourwalls',Home & Kitchen & Automotive,Home Furnishing
Karukraft Dokra Tribal Woman Showpiece  -  16 cm,b'Karukraft',Home & Kitchen & Automotive,Home Furnishing
Swayambhu Showpiece  -  30.5 cm,b'Swayambhu',Home & Kitchen & Automotive,Home Furnishing
Gift Island Asset Showpiece  -  30 cm,b'Gift Island',Home & Kitchen & Automotive,Home Furnishing
Green House Rajasthani-Female Showpiece  -  23 cm,b'Green House',Home & Kitchen & Automotive,Home Furnishing
Furncoms Doll Showpiece  -  24 cm,b'Furncoms',Home & Kitchen & Automotive,Home Furnishing
Vedic Deals Couple Radium Statues Showpiece  -  28 cm,b'Vedic Deals',Home & Kitchen & Automotive,Home Furnishing
Art Godaam Mask Showpiece  -  40 cm,b'Art Godaam',Home & Kitchen & Automotive,Home Furnishing
Serebroarts Iron Decorative Platter,b'Serebroarts',Home & Kitchen & Automotive,Home Furnishing
Chrome Showpiece  -  20 cm,b'Chrome',Home & Kitchen & Automotive,Home Furnishing
Hand Art Terracotta Mask Showpiece  -  28 cm,b'Hand Art',Home & Kitchen & Automotive,Home Furnishing
Kaatru Surya Bhagavan Showpiece  -  23.5 cm,b'Kaatru',Home & Kitchen & Automotive,Home Furnishing
Iron Crafts Creative Showpiece  -  21 cm,b'Iron Crafts',Home & Kitchen & Automotive,Home Furnishing
"C&E  TV-out Cable High Speed HDMI Cable Male to Female 15 Feet, 3 Pack",b'C&E',Home & Kitchen & Automotive,Home Furnishing
Sifty Collection Acrylic Painting,b'Sifty Collection',Home & Kitchen & Automotive,Home Furnishing
Trends On Wall Panihari Acrylic Painting,b'Trends On Wall',Home & Kitchen & Automotive,Home Furnishing
"SRK GROUPS Aluminium, Wooden Home Temple",b'SRK GROUPS',Home & Kitchen & Automotive,Home Furnishing
Skycandle.in Multicolor Paper Lantern,b'Skycandle.in',Home & Kitchen & Automotive,Home Furnishing
Elephant Brand 3 Fold Polka Dotted Prints - Manual Open Umbrella,b'Elephant Brand',Home & Kitchen & Automotive,Home Furnishing
Goodyear GY10004 Bolt Cutter,b'Goodyear',Home & Kitchen & Automotive,Home Furnishing
Artnconcept Abstract Cushions Cover,b'Artnconcept',Home & Kitchen & Automotive,Home Furnishing
Amore Square Wood Coaster Set,b'Amore',Home & Kitchen & Automotive,Home Furnishing
Amore Square Wood Coaster Set,b'Amore',Home & Kitchen & Automotive,Home Furnishing
Shop Rajasthan Cotton Floral Single Bedsheet,b'Shop Rajasthan',Home & Kitchen & Automotive,Home Furnishing
DECOREX 18W LED Surface Light (Light Colour : Cool White) Night Lamp,b'DECOREX',Home & Kitchen & Automotive,Home Furnishing
DECOREX 18W LED Surface Light (Light Colour : Cool White) Night Lamp,b'DECOREX',Home & Kitchen & Automotive,Home Furnishing
DECOREX 12W LED Panel Light (Light Colour : Cool White) Night Lamp,b'DECOREX',Home & Kitchen & Automotive,Home Furnishing
DECOREX 18W LED Down Light (Light Colour : Neutral White) Night Lamp,b'DECOREX',Home & Kitchen & Automotive,Home Furnishing
DECOREX 18W LED Surface Light (Warm White : Warm White) Night Lamp,b'DECOREX',Home & Kitchen & Automotive,Home Furnishing
Thoughtroad Small PAPER Sticker,b'Thoughtroad',Home & Kitchen & Automotive,Home Furnishing
DECOREX 6W LED Down Light (Light Colour : Neutral White) Night Lamp,b'DECOREX',Home & Kitchen & Automotive,Home Furnishing
Home Delight Colour Changing Automatic Sensor Mushroom Night Lamp,b'Home Delight',Home & Kitchen & Automotive,Home Furnishing
DECOREX 18W LED Panel Light (Light Colour : Neutral White) Night Lamp,b'DECOREX',Home & Kitchen & Automotive,Home Furnishing
DECOREX 6W LED Panel Light (Light Colour : Neutral White) Night Lamp,b'DECOREX',Home & Kitchen & Automotive,Home Furnishing
Thoughtroad Small PAPER Sticker,b'Thoughtroad',Home & Kitchen & Automotive,Home Furnishing
DECOREX 12W LED Down Light (Light Colour : Neutral White) Night Lamp,b'DECOREX',Home & Kitchen & Automotive,Home Furnishing
Thoughtroad Small PAPER Sticker,b'Thoughtroad',Home & Kitchen & Automotive,Home Furnishing
DECOREX 12W LED Down Light (Warm White : Warm White) Night Lamp,b'DECOREX',Home & Kitchen & Automotive,Home Furnishing
Kelvinator 190 L Direct Cool Single Door Refrigerator,b'Kelvinator',Home & Kitchen & Automotive,Home Furnishing
Anshuhandicrafts ASHCF125 Showpiece  -  13.97 cm,b'Anshuhandicrafts',Home & Kitchen & Automotive,Home Furnishing
Sitare Goddess Durga 24ct Gold Plated Showpiece  -  5.5 cm,b'Sitare',Home & Kitchen & Automotive,Home Furnishing
"TimberTaste 12"" Chatri Ganesha Showpiece  -  30 cm",b'TimberTaste',Home & Kitchen & Automotive,Home Furnishing
SportsHouse Radium Lord Ganesha Showpiece  -  19 cm,b'SportsHouse',Home & Kitchen & Automotive,Home Furnishing
krishna art Showpiece  -  7.62 cm,b'krishna art',Home & Kitchen & Automotive,Home Furnishing
Anshuhandicrafts ASHCF133 Showpiece  -  6.35 cm,b'Anshuhandicrafts',Home & Kitchen & Automotive,Home Furnishing
Balaji Art Lord Ganesha Pretty Pooja Idol - 14 cm Showpiece  -  14 cm,b'Balaji Art',Home & Kitchen & Automotive,Home Furnishing
SportsHouse makhan chor krishna Radium Showpiece  -  23 cm,b'SportsHouse',Home & Kitchen & Automotive,Home Furnishing
SportsHouse Lord Krishna Makhan Chor Radium Showpiece  -  19 cm,b'SportsHouse',Home & Kitchen & Automotive,Home Furnishing
CTW Ganpati Bapa Moriya Statue Showpiece  -  12 cm,b'CTW',Home & Kitchen & Automotive,Home Furnishing
"Astrodidi Gomati Chakra (21 Pieces) for Brings Prosperity, Happiness, Good Health & Wealth, Protect Children from evil effects and increasing your Spirituality Showpiece  -  2 cm",b'Astrodidi',Home & Kitchen & Automotive,Home Furnishing
nogaiya Pendants Ceiling Lamp,b'nogaiya',Home & Kitchen & Automotive,Home Furnishing
"Koncepts Cotton Medium Door Mat Mat, Door mat, Bathmat, room mat, rug, mats, bathroom mat, cotton mat, digital print mat, digital mat",b'Koncepts',Home & Kitchen & Automotive,Home Furnishing
"Koncepts Cotton Medium Door Mat Mat, Door mat, Bathmat, room mat, rug, mats, bathroom mat, cotton mat, digital print mat, digital mat",b'Koncepts',Home & Kitchen & Automotive,Home Furnishing
ELITE STATUES Showpiece  -  20 cm,b'ELITE STATUES',Home & Kitchen & Automotive,Home Furnishing
boom premium quality s-450-p Dynamic Wired Headphones,b'boom',Home & Kitchen & Automotive,Home Furnishing
Smart Wall Guru Small Adhesive Sticker Sticker,b'Smart Wall Guru',Home & Kitchen & Automotive,Home Furnishing
Smart Wall Guru Small Adhesive Sticker Sticker,b'Smart Wall Guru',Home & Kitchen & Automotive,Home Furnishing
Balaji Velvet Sofa Cover,b'Balaji',Home & Kitchen & Automotive,Home Furnishing
PIGEON RAPID ECO-LX Induction Cooktop,b'PIGEON',Home & Kitchen & Automotive,Home Furnishing
Collectible India Showpiece  -  19 cm,b'Collectible India',Home & Kitchen & Automotive,Home Furnishing
Gautam Buddha Showpiece  -  14 cm,b'Gautam Buddha',Home & Kitchen & Automotive,Home Furnishing
Laviva Exclusive Designer Set of 3 Fancy Rakhis with Thali Design Designer Rakhi,b'Laviva',Home & Kitchen & Automotive,Home Furnishing
Laviva Set of Three Fancy & Stone Rakhis with Thali Design Designer Rakhi,b'Laviva',Home & Kitchen & Automotive,Home Furnishing
Laviva Stunnig Set of Fancy & Swastik Rakhis Design Designer Rakhi,b'Laviva',Home & Kitchen & Automotive,Home Furnishing
ELEGANZE DECOR Wine Hand Bottle Holder Showpiece  -  15 cm,b'ELEGANZE DECOR',Home & Kitchen & Automotive,Home Furnishing
Stonkraft Musician Brass Figurine Showpiece  -  15.5 cm,b'Stonkraft',Home & Kitchen & Automotive,Home Furnishing
Masterhandicraft Brass Decorative Platter,b'Masterhandicraft',Home & Kitchen & Automotive,Home Furnishing
Seher Tribal Fibre Art Showpiece  -  44 cm,b'Seher',Home & Kitchen & Automotive,Home Furnishing
FS Brass Brass Decorative Platter,b'FS Brass',Home & Kitchen & Automotive,Home Furnishing
Shubham Exports Showpiece  -  28 cm,b'Shubham Exports',Home & Kitchen & Automotive,Home Furnishing
Ibz Micromax E390 Dock,b'Ibz',Home & Kitchen & Automotive,Home Furnishing
