name,brand,category1,category2
FabHomeDecor Fabric Double Sofa Bed,b'FabHomeDecor',Home & Kitchen & Automotive,Home Furnishing
FabHomeDecor Fabric Double Sofa Bed,b'FabHomeDecor',Home & Kitchen & Automotive,Home Furnishing
FabHomeDecor Fabric Double Sofa Bed,b'FabHomeDecor',Home & Kitchen & Automotive,Home Furnishing
FabHomeDecor Fabric Double Sofa Bed,b'FabHomeDecor',Home & Kitchen & Automotive,Home Furnishing
OM SHIVAKRITI Square wall Clock Showpiece  -  38.1 cm,b'OM SHIVAKRITI',Home & Kitchen & Automotive,Home Furnishing
Elegance Polyester Multicolor Abstract Eyelet Door Curtain,b'Elegance',Home & Kitchen & Automotive,Home Furnishing
SANTOSH ROYAL FASHION Cotton Printed King sized Double Bedsheet,b'SANTOSH ROYAL FASHION',Home & Kitchen & Automotive,Home Furnishing
Jaipur Print Cotton Floral King sized Double Bedsheet,b'Jaipur Print',Home & Kitchen & Automotive,Home Furnishing
Jaipur Print Cotton Floral King sized Double Bedsheet,b'Jaipur Print',Home & Kitchen & Automotive,Home Furnishing
Redbag Eight Armed Goddess Sherawali Maa Showpiece  -  10.8 cm,b'Redbag',Home & Kitchen & Automotive,Home Furnishing
First Choice Cotton Embroidered Diwan Set,b'First Choice',Home & Kitchen & Automotive,Home Furnishing
First Choice Cotton Embroidered Diwan Set,b'First Choice',Home & Kitchen & Automotive,Home Furnishing
First Choice Cotton Embroidered Diwan Set,b'First Choice',Home & Kitchen & Automotive,Home Furnishing
First Choice Cotton Embroidered Diwan Set,b'First Choice',Home & Kitchen & Automotive,Home Furnishing
SANTOSH ROYAL FASHION Cotton Embroidered Diwan Set,b'SANTOSH ROYAL FASHION',Home & Kitchen & Automotive,Home Furnishing
First Choice Cotton Embroidered Diwan Set,b'First Choice',Home & Kitchen & Automotive,Home Furnishing
House This Queen Cotton Duvet Cover,b'House This',Home & Kitchen & Automotive,Home Furnishing
Skipper Blends Aqua Striped Eyelet Window Curtain,b'Skipper',Home & Kitchen & Automotive,Home Furnishing
Pure Source Psi-As-Hanggnrlx Relaxing Liquid Air Freshener,b'Pure Source',Home & Kitchen & Automotive,Home Furnishing
Kings Multicolor Tassels,b'Kings',Home & Kitchen & Automotive,Home Furnishing
Eshoppee Laughing Buddha For Success And Wealth Showpiece  -  12 cm,b'Eshoppee',Home & Kitchen & Automotive,Home Furnishing
Karigaari Set Of 5 Adivasi Doing Merry On Trumpet Showpiece  -  30 cm,b'Karigaari',Home & Kitchen & Automotive,Home Furnishing
JDX Plain Bed/Sleeping Pillow,b'JDX',Home & Kitchen & Automotive,Home Furnishing
JDX Plain Bed/Sleeping Pillow,b'JDX',Home & Kitchen & Automotive,Home Furnishing
JDX Plain Bed/Sleeping Pillow,b'JDX',Home & Kitchen & Automotive,Home Furnishing
JDX Plain Bed/Sleeping Pillow,b'JDX',Home & Kitchen & Automotive,Home Furnishing
JDX Plain Bed/Sleeping Pillow,b'JDX',Home & Kitchen & Automotive,Home Furnishing
JDX Plain Bed/Sleeping Pillow,b'JDX',Home & Kitchen & Automotive,Home Furnishing
Riva Carpets Cotton Free Bath Mat Classic Shag Bathmat-RI-04,b'Riva Carpets',Home & Kitchen & Automotive,Home Furnishing
Riva Carpets Cotton Free Bath Mat Classic Loop Shag Bathmat_RI-527,b'Riva Carpets',Home & Kitchen & Automotive,Home Furnishing
Riva Carpets Cotton Free Bath Mat Classic Shag Bathmat-RI-04,b'Riva Carpets',Home & Kitchen & Automotive,Home Furnishing
Riva Carpets Cotton Free Bath Mat Classic Shag Bathmat-RI-04,b'Riva Carpets',Home & Kitchen & Automotive,Home Furnishing
Riva Carpets Cotton Free Bath Mat Classic Shag Bathmat-RI-04,b'Riva Carpets',Home & Kitchen & Automotive,Home Furnishing
Myesquire Square Pot Aroma Electric Burner Lemongrass Liquid Air Freshener,b'Myesquire',Home & Kitchen & Automotive,Home Furnishing
Myesquire Black and White Aroma Burner Combo Lemongrass Liquid Air Freshener,b'Myesquire',Home & Kitchen & Automotive,Home Furnishing
Myesquire Oval Electric Aroma Lemongrass Liquid Air Freshener,b'Myesquire',Home & Kitchen & Automotive,Home Furnishing
Myesquire Oval Electric Aroma Lemongrass Liquid Air Freshener,b'Myesquire',Home & Kitchen & Automotive,Home Furnishing
Myesquire Ceramic Coffee Burner Pot Lemongrass Liquid Air Freshener,b'Myesquire',Home & Kitchen & Automotive,Home Furnishing
Myesquire Blue Green Aroma Burner Combo Lemongrass Liquid Air Freshener,b'Myesquire',Home & Kitchen & Automotive,Home Furnishing
Myesquire White Brown Aroma Burner Combo Lemongrass Liquid Air Freshener,b'Myesquire',Home & Kitchen & Automotive,Home Furnishing
Myesquire Brown Aroma Burner Combo Lemongrass Liquid Air Freshener,b'Myesquire',Home & Kitchen & Automotive,Home Furnishing
Myesquire Ceramic Burner Pot Lemongrass Liquid Air Freshener,b'Myesquire',Home & Kitchen & Automotive,Home Furnishing
Myesquire Ceramic Burner Pot Lemongrass Liquid Air Freshener,b'Myesquire',Home & Kitchen & Automotive,Home Furnishing
LG MC3286BLT 32 L Convection Microwave Oven,b'LG',Home & Kitchen & Automotive,Home Furnishing
KalaBhawan Stair Sculpture Showpiece  -  39 cm,b'KalaBhawan',Home & Kitchen & Automotive,Home Furnishing
Serebroarts Iron Decorative Platter,b'Serebroarts',Home & Kitchen & Automotive,Home Furnishing
Sunrise Showpiece  -  28 cm,b'Sunrise',Home & Kitchen & Automotive,Home Furnishing
JMD Printed Cushions Cover,b'JMD',Home & Kitchen & Automotive,Home Furnishing
JMD Printed Cushions Cover,b'JMD',Home & Kitchen & Automotive,Home Furnishing
Devinez Home Liquid Air Freshener,b'Devinez',Home & Kitchen & Automotive,Home Furnishing
Kripa's Printed Cushions Cover,"b""Kripa's""",Home & Kitchen & Automotive,Home Furnishing
ROSEMOORE Home Gel Air Freshener,b'ROSEMOORE',Home & Kitchen & Automotive,Home Furnishing
Itiha Home Liquid Air Freshener,b'Itiha',Home & Kitchen & Automotive,Home Furnishing
Itiha Home Liquid Air Freshener,b'Itiha',Home & Kitchen & Automotive,Home Furnishing
Itiha Home Liquid Air Freshener,b'Itiha',Home & Kitchen & Automotive,Home Furnishing
MohanJodero Showpiece  -  46 cm,b'MohanJodero',Home & Kitchen & Automotive,Home Furnishing
"Asian Aura Electric Burner Rose, Vanilla Liquid Air Freshener",b'Asian Aura',Home & Kitchen & Automotive,Home Furnishing
The Decor mart Leatherette Photo Frame,b'The Decor mart',Home & Kitchen & Automotive,Home Furnishing
Bharatcraft Lord Ganesha with Diya on Leaf Showpiece  -  10.16 cm,b'Bharatcraft',Home & Kitchen & Automotive,Home Furnishing
Prime Printed 4 Seater Table Cover,b'Prime',Home & Kitchen & Automotive,Home Furnishing
Prime Printed 4 Seater Table Cover,b'Prime',Home & Kitchen & Automotive,Home Furnishing
Weldecor Picture Light Wall Lamp,b'Weldecor',Home & Kitchen & Automotive,Home Furnishing
Prime Printed 6 Seater Table Cover,b'Prime',Home & Kitchen & Automotive,Home Furnishing
Prime Printed 8 Seater Table Cover,b'Prime',Home & Kitchen & Automotive,Home Furnishing
Prime Printed 4 Seater Table Cover,b'Prime',Home & Kitchen & Automotive,Home Furnishing
Prime Printed 6 Seater Table Cover,b'Prime',Home & Kitchen & Automotive,Home Furnishing
Blue Birds USA Homeware Aluminium water bottle 750 ml Bottle,b'Blue Birds USA Homeware',Home & Kitchen & Automotive,Home Furnishing
Blue Birds Usa Homeware Stainless Steel 1000 ml Bottle,b'Blue Birds Usa Homeware',Home & Kitchen & Automotive,Home Furnishing
SHEFFIELD CLASSIC SH-83-VC1 Hand-held Vacuum Cleaner,b'SHEFFIELD CLASSIC',Home & Kitchen & Automotive,Home Furnishing
Jaipur Print Cotton Floral Diwan Set,b'Jaipur Print',Home & Kitchen & Automotive,Home Furnishing
VarEesha Wooden Key Holder,b'VarEesha',Home & Kitchen & Automotive,Home Furnishing
AND Designs Artistic Wooden Key Holder Wooden Key Holder,b'AND Designs',Home & Kitchen & Automotive,Home Furnishing
Stealodeal Grand Harvest 11 Function Multi Utility Swiss Knife,b'Stealodeal',Home & Kitchen & Automotive,Home Furnishing
VarEesha Wooden Key Holder,b'VarEesha',Home & Kitchen & Automotive,Home Furnishing
BI Classics Wallpaper,b'BI',Home & Kitchen & Automotive,Home Furnishing
Treasure Showpiece  -  23 cm,b'Treasure',Home & Kitchen & Automotive,Home Furnishing
Plush SHOPRENCH Double Sided Pipe Wrench Set,b'Plush',Home & Kitchen & Automotive,Home Furnishing
@home Glass Vase,b'@home',Home & Kitchen & Automotive,Home Furnishing
MayurShilpa Paper Vase,b'MayurShilpa',Home & Kitchen & Automotive,Home Furnishing
Smart Wall Guru Medium Adhesive Sticker,b'Smart Wall Guru',Home & Kitchen & Automotive,Home Furnishing
Opaleena MDF Wall Shelf,b'Opaleena',Home & Kitchen & Automotive,Home Furnishing
AYMH MDF Wall Shelf,b'AYMH',Home & Kitchen & Automotive,Home Furnishing
Hemden Embroidered Cushions Cover,b'Hemden',Home & Kitchen & Automotive,Home Furnishing
Craft Trade Oval Wood Coaster Set,b'Craft Trade',Home & Kitchen & Automotive,Home Furnishing
Magical Knots 3D Printed Cushions Cover,b'Magical Knots',Home & Kitchen & Automotive,Home Furnishing
Tallenge Art For Kitchen - Today's Menu - Premium Quality A3 Size Framed Poster Paper Print,b'Tallenge',Home & Kitchen & Automotive,Home Furnishing
Gold Dust MO3007 Automatic Sun Hand Green Manual Sewing Machine,b'Gold Dust',Home & Kitchen & Automotive,Home Furnishing
ARIHANT Multicolor Rod Rail Bracket,b'ARIHANT',Home & Kitchen & Automotive,Home Furnishing
SKY TRENDS GIFT Square Wood Coaster,b'SKY TRENDS GIFT',Home & Kitchen & Automotive,Home Furnishing
Magical Knots 3D Printed Cushions Cover,b'Magical Knots',Home & Kitchen & Automotive,Home Furnishing
Tallenge Old Masters Collection - Port Marly by Alfred Sisley - Premium Quality A3 Size Framed Poster Paper Print,b'Tallenge',Home & Kitchen & Automotive,Home Furnishing
Gold Dust ABC23007 Automatic Sun Hand Red Manual Sewing Machine,b'Gold Dust',Home & Kitchen & Automotive,Home Furnishing
SUNFLAME PEARL Dry Iron,b'SUNFLAME',Home & Kitchen & Automotive,Home Furnishing
Diviniti DG Royal Ornamental Size 4 Allha religious wall hanging Showpiece  -  30.5 cm,b'Diviniti',Home & Kitchen & Automotive,Home Furnishing
Parv Collections Showpiece  -  9 cm,b'Parv Collections',Home & Kitchen & Automotive,Home Furnishing
Parv Collections Showpiece  -  12 cm,b'Parv Collections',Home & Kitchen & Automotive,Home Furnishing
Diviniti DG Royal Ornamental Size 4.5 Murgan Ji religious wall hanging Showpiece  -  30.5 cm,b'Diviniti',Home & Kitchen & Automotive,Home Furnishing
Iron Crafts Creative Showpiece  -  21 cm,b'Iron Crafts',Home & Kitchen & Automotive,Home Furnishing
Aaina Home Decor Traditional Series-WB-103 Storage Vanity Basket,b'Aaina',Home & Kitchen & Automotive,Home Furnishing
Exotic India Adi Buddha Vajrasattva Showpiece  -  27.94 cm,b'Exotic India',Home & Kitchen & Automotive,Home Furnishing
Aapno Rajasthan Princess Design Showpiece  -  22 cm,b'Aapno Rajasthan',Home & Kitchen & Automotive,Home Furnishing
Diviniti Dg Royal Ornamental Size 2.5 Murgan Religious Wall Hanging Showpiece  -  28 cm,b'Diviniti',Home & Kitchen & Automotive,Home Furnishing
ARK Creation Baster Tribal Lady Showpiece  -  20 cm,b'ARK Creation',Home & Kitchen & Automotive,Home Furnishing
Exotic India Vaishnava Symbols - Shankha And Chakra Showpiece  -  37 cm,b'Exotic India',Home & Kitchen & Automotive,Home Furnishing
ARK Creation Baster Tribal Lady Showpiece  -  20 cm,b'ARK Creation',Home & Kitchen & Automotive,Home Furnishing
Paras Purple Beautyfullady Flower Pot Showpiece  -  70 cm,b'Paras',Home & Kitchen & Automotive,Home Furnishing
Diviniti DG Royal Ornamental Size 4 Ganesha religious wall hanging Showpiece  -  30.5 cm,b'Diviniti',Home & Kitchen & Automotive,Home Furnishing
Right Florist Showpiece  -  11 cm,b'Right Florist',Home & Kitchen & Automotive,Home Furnishing
Exotic India Relaxing Ganesha Showpiece  -  11.43 cm,b'Exotic India',Home & Kitchen & Automotive,Home Furnishing
Sixthsense Women of African Tribes Showpiece  -  9 cm,b'Sixthsense',Home & Kitchen & Automotive,Home Furnishing
BeYOUtiful Copper Repouss�� - Man With Dhol Showpiece  -  36 cm,b'BeYOUtiful',Home & Kitchen & Automotive,Home Furnishing
Exotic India Blessing Buddha Showpiece  -  36.83 cm,b'Exotic India',Home & Kitchen & Automotive,Home Furnishing
Amba Handicraft 3 Face Clock Showpiece  -  64 cm,b'Amba Handicraft',Home & Kitchen & Automotive,Home Furnishing
Diviniti DG 4 Khanda Sahib With Gold Plated Foil Wall Hanging Showpiece  -  37 cm,b'Diviniti',Home & Kitchen & Automotive,Home Furnishing
My Angel Gifts Show Piece Showpiece  -  5 cm,b'My Angel',Home & Kitchen & Automotive,Home Furnishing
Diviniti DG Royal Ornamental Size 4 Gurunanak religious wall hanging Showpiece  -  30.5 cm,b'Diviniti',Home & Kitchen & Automotive,Home Furnishing
Paras Rajasthani Man 1 Showpiece  -  27 cm,b'Paras',Home & Kitchen & Automotive,Home Furnishing
Seher Tribal Fibre Art Showpiece  -  36 cm,b'Seher',Home & Kitchen & Automotive,Home Furnishing
Adaa Gold Plated - Classic Angle With Crystals Showpiece  -  14 cm,b'Adaa',Home & Kitchen & Automotive,Home Furnishing
Diviniti MDF Color Religious Wall Hanging Size 4 Sai Baba Showpiece  -  36.4 cm,b'Diviniti',Home & Kitchen & Automotive,Home Furnishing
Karigaari Gopi's Playing Music Wall Hanging Showpiece  -  49 cm,b'Karigaari',Home & Kitchen & Automotive,Home Furnishing
Diviniti DG 3 Khanda Sahib With Gold Plated Foil Wall Hanging Showpiece  -  32.5 cm,b'Diviniti',Home & Kitchen & Automotive,Home Furnishing
SR Crafts Showpiece  -  15.24 cm,b'SR Crafts',Home & Kitchen & Automotive,Home Furnishing
Diviniti Mdf Royal Religious Wall Hanging Size 2.5 Bal Gopal Showpiece  -  25 cm,b'Diviniti',Home & Kitchen & Automotive,Home Furnishing
FOCI Dancing Couple Showpiece  -  10 cm,b'FOCI',Home & Kitchen & Automotive,Home Furnishing
E-Studio Ganesha Caturbhuja Showpiece  -  12 cm,b'E-Studio',Home & Kitchen & Automotive,Home Furnishing
Handecor Ballet Dancer Showpiece  -  30 cm,b'Handecor',Home & Kitchen & Automotive,Home Furnishing
Diviniti MDF Color religious wall hanging Size 4.5 Mahaveer Showpiece  -  62.5 cm,b'Diviniti',Home & Kitchen & Automotive,Home Furnishing
Green House African-Tribal-Male Showpiece  -  35.5 cm,b'Green House',Home & Kitchen & Automotive,Home Furnishing
Diviniti MDF Color Religious Wall Hanging Size 4 Radha Krishna Showpiece  -  36.4 cm,b'Diviniti',Home & Kitchen & Automotive,Home Furnishing
K&P Lord Ganesha Regular 16 Showpiece  -  13 cm,b'K&P',Home & Kitchen & Automotive,Home Furnishing
Gift Island Actn Showpiece  -  8 cm,b'Gift Island',Home & Kitchen & Automotive,Home Furnishing
Samradhi Floral Double Dohar Multicolor,b'Samradhi',Home & Kitchen & Automotive,Home Furnishing
Rama Floral Single Quilts & Comforters Pink-Red,b'Rama',Home & Kitchen & Automotive,Home Furnishing
Rama Floral Single Quilts & Comforters Yellow,b'Rama',Home & Kitchen & Automotive,Home Furnishing
Cloth Fusion Plain Single Blanket Camel,b'Cloth Fusion',Home & Kitchen & Automotive,Home Furnishing
Silkworm Printed Single Dohar Multicolor,b'Silkworm',Home & Kitchen & Automotive,Home Furnishing
Shop Rajasthan Abstract Single Dohar Multicolor,b'Shop Rajasthan',Home & Kitchen & Automotive,Home Furnishing
cotton leaf Floral Single Blanket 104,b'cotton leaf',Home & Kitchen & Automotive,Home Furnishing
El Sandlo Floral Double Blanket Multicolour,b'El Sandlo',Home & Kitchen & Automotive,Home Furnishing
El Sandlo Floral Double Blanket Multicolour,b'El Sandlo',Home & Kitchen & Automotive,Home Furnishing
Silkworm Printed Single Dohar Multicolor,b'Silkworm',Home & Kitchen & Automotive,Home Furnishing
Shiv Textile Abstract Double Blanket Multicolor,b'Shiv Textile',Home & Kitchen & Automotive,Home Furnishing
Tycab 10 inch Black (250 mm x 3.6 mm) - 1 Pack of 100 Nylon Standard Cable Tie,b'Tycab',Home & Kitchen & Automotive,Home Furnishing
Artisan Creation Checkered Single Quilts & Comforters Brown,b'Artisan Creation',Home & Kitchen & Automotive,Home Furnishing
"Goyal India 31 cm Iron, Glass Garden Stake",b'Goyal India',Home & Kitchen & Automotive,Home Furnishing
Artisan Creation Floral Single Quilts & Comforters White,b'Artisan Creation',Home & Kitchen & Automotive,Home Furnishing
Blanket Zone Printed Single Quilts & Comforters Multicolor,b'Blanket Zone',Home & Kitchen & Automotive,Home Furnishing
Silkworm Printed Single Dohar Multicolor,b'Silkworm',Home & Kitchen & Automotive,Home Furnishing
Bagru Crafts Floral Single Quilts & Comforters Multicolor,b'Bagru Crafts',Home & Kitchen & Automotive,Home Furnishing
Rama Floral Single Quilts & Comforters Blue,b'Rama',Home & Kitchen & Automotive,Home Furnishing
Rama Floral Single Quilts & Comforters Blue-Beige,b'Rama',Home & Kitchen & Automotive,Home Furnishing
Remtex Export Cartoon Single Dohar Multicolor,b'Remtex Export',Home & Kitchen & Automotive,Home Furnishing
Tradition India Floral Single Quilts & Comforters Multicolor,b'Tradition India',Home & Kitchen & Automotive,Home Furnishing
Eternity Handcrafted unique Mosaic Glass Table Lamp,b'Eternity',Home & Kitchen & Automotive,Home Furnishing
Exotic India Bhagwan Vishnu Showpiece  -  22.86 cm,b'Exotic India',Home & Kitchen & Automotive,Home Furnishing
Empreus MDF Photo Frame,b'Empreus',Home & Kitchen & Automotive,Home Furnishing
IBS Plastic Portable Laptop Table,b'IBS',Home & Kitchen & Automotive,Home Furnishing
IBS ADJUSTABLE FOLDING KIDS MATE HOME OFFICE READING WRITING TABLEMATE WITH CUPHOLDER Plastic Portable Laptop Table,b'IBS',Home & Kitchen & Automotive,Home Furnishing
IBS ADJUSTABLE FOLDING KIDS MATE HOME OFFICE READING WRITING STUDY TABLEMATE WITH CUPHOLDER Plastic Portable Laptop Table,b'IBS',Home & Kitchen & Automotive,Home Furnishing
IBS Plastic Portable Laptop Table,b'IBS',Home & Kitchen & Automotive,Home Furnishing
IBS ADJUSTABLE FOLDING KIDS MATE HOME OFFICE READING WRITING TABLEMATE WITH CUPHOLDER Plastic Portable Laptop Table,b'IBS',Home & Kitchen & Automotive,Home Furnishing
IBS Plastic Portable Laptop Table,b'IBS',Home & Kitchen & Automotive,Home Furnishing
IBS Plastic Portable Laptop Table,b'IBS',Home & Kitchen & Automotive,Home Furnishing
induscraft Solid Wood Computer Desk,b'induscraft',Home & Kitchen & Automotive,Home Furnishing
Prachin Varaha Laxmi Sitting Showpiece  -  11 cm,b'Prachin',Home & Kitchen & Automotive,Home Furnishing
Exotic India Lord Ganesha Playing Flute (Carved in Sunstone) Showpiece  -  6.8580000000000005 cm,b'Exotic India',Home & Kitchen & Automotive,Home Furnishing
Collectible India Relaxing Conch Ganesha Brass Idol - Antique Finish Statue Showpiece  -  17.5 cm,b'Collectible India',Home & Kitchen & Automotive,Home Furnishing
Recrafto Buddha Showpiece  -  15.24 cm,b'Recrafto',Home & Kitchen & Automotive,Home Furnishing
Interio Crafts Brass Gramophone,b'Interio Crafts',Home & Kitchen & Automotive,Home Furnishing
Exotic India Lord Ganesha (Carved in Hematite) Showpiece  -  5.08 cm,b'Exotic India',Home & Kitchen & Automotive,Home Furnishing
Quilt India Floral Cushions Cover,b'Quilt India',Home & Kitchen & Automotive,Home Furnishing
Quilt India Floral Cushions Cover,b'Quilt India',Home & Kitchen & Automotive,Home Furnishing
Rajrang Carved Pattern Elephant Showpiece  -  8 cm,b'Rajrang',Home & Kitchen & Automotive,Home Furnishing
Quilt India Floral Cushions Cover,b'Quilt India',Home & Kitchen & Automotive,Home Furnishing
Quilt India Floral Cushions Cover,b'Quilt India',Home & Kitchen & Automotive,Home Furnishing
Quilt India Floral Cushions Cover,b'Quilt India',Home & Kitchen & Automotive,Home Furnishing
Quilt India Floral Cushions Cover,b'Quilt India',Home & Kitchen & Automotive,Home Furnishing
Quilt India Floral Cushions Cover,b'Quilt India',Home & Kitchen & Automotive,Home Furnishing
Holy Krishna Showpiece  -  19.5 cm,b'Holy Krishna',Home & Kitchen & Automotive,Home Furnishing
Hand Art Showpiece  -  38 cm,b'Hand Art',Home & Kitchen & Automotive,Home Furnishing
Shyam Fashion Brass Vase,b'Shyam Fashion',Home & Kitchen & Automotive,Home Furnishing
Goldcave G211 Faucet Set,b'Goldcave',Home & Kitchen & Automotive,Home Furnishing
Ganga 1514 New Line Wall Mixer 3 In 1 System With Provision For Both Telephone Shower & Overhead Shower Faucet Set,b'Ganga',Home & Kitchen & Automotive,Home Furnishing
Craftcart Parrot Antique Brass Key Holder,b'Craftcart',Home & Kitchen & Automotive,Home Furnishing
Ganga 2110 Eva Wall Mixer With Bend For Arrangement of Overhead Shower Faucet Set,b'Ganga',Home & Kitchen & Automotive,Home Furnishing
Ganga 2113 Eva Flush Cock With Washer System And Adjustable Wall Flange (25 mm) Faucet Set,b'Ganga',Home & Kitchen & Automotive,Home Furnishing
Being Nawab 6 inch Glass Hookah,b'Being Nawab',Home & Kitchen & Automotive,Home Furnishing
Being Nawab 6 inch Glass Hookah,b'Being Nawab',Home & Kitchen & Automotive,Home Furnishing
Arsalan 10.5 inch Glass Hookah,b'Arsalan',Home & Kitchen & Automotive,Home Furnishing
Arsalan Designer Pumpkin Permanent Color 10.5 inch Glass Hookah,b'Arsalan',Home & Kitchen & Automotive,Home Furnishing
House This Cotton Pink Floral Eyelet Window Curtain,b'House This',Home & Kitchen & Automotive,Home Furnishing
Ruchiworld Pure 3 Piece Handicraft Canon Set Gift Showpiece  -  6 cm,b'Ruchiworld',Home & Kitchen & Automotive,Home Furnishing
S C Handicrafts Showpiece  -  23 cm,b'S C Handicrafts',Home & Kitchen & Automotive,Home Furnishing
RajLaxmi Showpiece  -  10 cm,b'RajLaxmi',Home & Kitchen & Automotive,Home Furnishing
Ravishing Variety Iron Statue Showpiece  -  5 cm,b'Ravishing Variety',Home & Kitchen & Automotive,Home Furnishing
Rastogi Handicrafts Showpiece  -  20 cm,b'Rastogi Handicrafts',Home & Kitchen & Automotive,Home Furnishing
"Monil Aluminium, Crystal Decorative Platter Showpiece  -  4.5 cm",b'Monil',Home & Kitchen & Automotive,Home Furnishing
Lal Haveli Antique Indian Home Decor Handmade Painted Pair of Wooden Sculpture / Statue of Door Keeper Showpiece  -  76.2 cm,b'Lal Haveli',Home & Kitchen & Automotive,Home Furnishing
NEHP NEH006 Showpiece  -  38.1 cm,b'NEHP',Home & Kitchen & Automotive,Home Furnishing
Sovam International Marble Elephant Pair Showpiece  -  5 cm,b'Sovam International',Home & Kitchen & Automotive,Home Furnishing
S C Handicrafts Sandalwood Carved Chinese Queen Big Showpiece  -  20 cm,b'S C Handicrafts',Home & Kitchen & Automotive,Home Furnishing
Tatvaarts Urli Showpiece  -  21.59 cm,b'Tatvaarts',Home & Kitchen & Automotive,Home Furnishing
Ona'S Rajasthani Puppet Showpiece  -  56 cm,"b""Ona'S""",Home & Kitchen & Automotive,Home Furnishing
Shoppingtara Beautiful Golden Meenakari Work Marble Table Clock Showpiece  -  7 cm,b'Shoppingtara',Home & Kitchen & Automotive,Home Furnishing
Sovam International Dancing God Shiva-natraja Brass Statue/figurine Showpiece  -  7 cm,b'Sovam International',Home & Kitchen & Automotive,Home Furnishing
Onlineshoppee CA106 Showpiece  -  30 cm,b'Onlineshoppee',Home & Kitchen & Automotive,Home Furnishing
Sovam International Pure 3 Piece Handicraft Canon Set Gift Showpiece  -  6 cm,b'Sovam International',Home & Kitchen & Automotive,Home Furnishing
S C Handicrafts Showpiece  -  26 cm,b'S C Handicrafts',Home & Kitchen & Automotive,Home Furnishing
Siri Creations Gold Foil Hibiscus small Showpiece  -  1.5 cm,b'Siri Creations',Home & Kitchen & Automotive,Home Furnishing
Ratash.Com SH_0444_45_36 Showpiece  -  4 cm,b'Ratash.Com',Home & Kitchen & Automotive,Home Furnishing
Tatvaarts Rajasthani Musicial Set Showpiece  -  15.24 cm,b'Tatvaarts',Home & Kitchen & Automotive,Home Furnishing
Surface180 Wonderful Wooden Antique Drawer Box Showpiece  -  20 cm,b'Surface180',Home & Kitchen & Automotive,Home Furnishing
Lal Haveli Decorative Hand Painted Iron African Lady Tealight Stand Showpiece  -  30.48 cm,b'Lal Haveli',Home & Kitchen & Automotive,Home Furnishing
Tiedribbons We Love Mom Tile Showpiece  -  28 cm,b'Tiedribbons',Home & Kitchen & Automotive,Home Furnishing
SAC FA-RK-28X28 Showpiece  -  89 cm,b'SAC',Home & Kitchen & Automotive,Home Furnishing
Utkalika Dhokra Tiger With Dee #355DC912 Showpiece  -  9 cm,b'Utkalika',Home & Kitchen & Automotive,Home Furnishing
Tiedribbons Two Tone Happy Mothers Day Tile Showpiece  -  28 cm,b'Tiedribbons',Home & Kitchen & Automotive,Home Furnishing
MCB Exports Mini 4 Drawer Chest Showpiece  -  21 cm,b'MCB Exports',Home & Kitchen & Automotive,Home Furnishing
Ray-Pro Lady Figure Showpiece  -  33 cm,b'Ray-Pro',Home & Kitchen & Automotive,Home Furnishing
Sovam International Marble Elephant Pair Showpiece  -  5 cm,b'Sovam International',Home & Kitchen & Automotive,Home Furnishing
Shoppingtara Wooden Elephant Showpiece  -  4 cm,b'Shoppingtara',Home & Kitchen & Automotive,Home Furnishing
Lal Haveli Beautiful Wooden Jharoka Photo Frames Showpiece  -  40.64 cm,b'Lal Haveli',Home & Kitchen & Automotive,Home Furnishing
Shree Homdecor Floor rangoli Showpiece  -  21 cm,b'Shree Homdecor',Home & Kitchen & Automotive,Home Furnishing
MCB Exports Marigold Decorative Pot Showpiece  -  30 cm,b'MCB Exports',Home & Kitchen & Automotive,Home Furnishing
Ona'S Rajasthani Puppet Showpiece  -  80 cm,"b""Ona'S""",Home & Kitchen & Automotive,Home Furnishing
Shoppingtara Canon Handicraft Home Decor Showpiece  -  5 cm,b'Shoppingtara',Home & Kitchen & Automotive,Home Furnishing
Mahadev Handicrafts Minakari Work Fruit Bowl Showpiece  -  5 cm,b'Mahadev Handicrafts',Home & Kitchen & Automotive,Home Furnishing
Tatvaarts Tribal Musicians ( Turquoise Stone) Showpiece  -  10.16 cm,b'Tatvaarts',Home & Kitchen & Automotive,Home Furnishing
Lal Haveli Beautiful Decorative Wooden Jharoka Wall Decor Showpiece  -  30.48 cm,b'Lal Haveli',Home & Kitchen & Automotive,Home Furnishing
Triston Home Wheel Pizza Cutter,b'Triston Home',Home & Kitchen & Automotive,Home Furnishing
Triston Home Wheel Pizza Cutter,b'Triston Home',Home & Kitchen & Automotive,Home Furnishing
S C Handicrafts Showpiece  -  62 cm,b'S C Handicrafts',Home & Kitchen & Automotive,Home Furnishing
Prachin Compass Jacko Boot W/Li Showpiece  -  2.5 cm,b'Prachin',Home & Kitchen & Automotive,Home Furnishing
Lal Haveli Decorative Colorful Handmade Rajasthani Iron Musician Set Of 5 Pcs Showpiece  -  56 cm,b'Lal Haveli',Home & Kitchen & Automotive,Home Furnishing
Surface 180 Set of 2 Rajasthani Wooden Watch Man With Hand Painting Showpiece  -  26 cm,b'Surface 180',Home & Kitchen & Automotive,Home Furnishing
Sovam International Ganpati Showpiece  -  6 cm,b'Sovam International',Home & Kitchen & Automotive,Home Furnishing
